nama_penulis,rating,teks_ulasan,waktu,likes,case_holding_sentimen,sentimen,ulasan_bersih
Deny Kristianto,5.0,"Mantep recommended buat mahasiswa, kesini buat nyari laptop buat skripsi. Pelyanan oke, tempat nyaman ber AC",3 years ago,0,Netral,Positif,mantep recommended mahasiswa kesini nyari laptop skripsi pelyanan oke nyaman ber ac
Pamungkas Soegihartoko,5.0,"Exelent. 👍
Barang oke, pelayanan oke, harga oke..
Recomended. Thanks bro...",Edited a year ago,0,Positif,Positif,exelent barang oke layan oke harga oke recomended thanks bro
Thoriq El Karim,5.0,"Mantappp, laptopnya walau bekas tapi worth it. Harga ada yang murah, pokoknya mantap",2 years ago,0,Positif,Positif,mantappp laptop bekas worth it harga murah pokok mantap
annisa caca,5.0,Barang dan pelayanannya terbaik,8 months ago,0,Netral,Positif,barang layan baik
Herlambang Purnomo,5.0,"Pelayanan bagus,ramah,stock barangnya lengkap👍",2 years ago,0,Netral,Positif,layan bagusramahstock barang lengkap
058_ Achmad Sofyan,5.0,"Masnya ramah, laptopnya berkualitas dan dikasih bonus pula.",2 years ago,0,Netral,Positif,mas ramah laptop kualitas kasih bonus
Ali Hasan,5.0,Mantep buat mahasiswa yang pengin cari device berkelas dengan harga bersahabat 🔥,a year ago,0,Netral,Positif,mantep mahasiswa pengin cari device kelas harga sahabat
Agung Arif Wibowo,5.0,Pelayanan dan barang bagus,a year ago,0,Netral,Positif,layan barang bagus
Sholichatun Nisa,5.0,Very trusted & recommended seller. Tempat nya nyaman dan penjualnya ramah.,3 years ago,0,Positif,Positif,very trusted recommended seller nya nyaman jual ramah
Ibu Sumyati,5.0,Pelayanan ramah dan kualitas laptop bagus,a year ago,0,Netral,Positif,layan ramah kualitas laptop bagus
Ibnu Hidayat,5.0,"Pelayanan ramah, recomended cari laptop second",2 years ago,0,Netral,Positif,layan ramah recomended cari laptop second
Muhammad Anas Nazarudin,5.0,"Toko Laptop terbaik sepanjang masa. Hari kiamat tetap buka
Mantapss",2 years ago,0,Netral,Positif,toko laptop baik kiamat buka mantapss
beni habibie,5.0,"Pelayanan ramah, informatif dan harga kompetitif, semoga tambah sukses",2 years ago,0,Netral,Positif,layan ramah informatif harga kompetitif moga sukses
Nugraha Dewa,5.0,"Beli dan antar sampai Bali dengan aman sentosa tanpa hambatan, sukses selalu bisnisnya",3 years ago,0,Netral,Positif,beli bal aman sentosa hambat sukses bisnis
Komplang Bagus,5.0,Barang bagus dan dapet bonus,a year ago,0,Netral,Positif,barang bagus dapet bonus
Hasan Saputrah,5.0,Pelayanan ramah dn smoga awet laptop nya,a year ago,0,Netral,Positif,layan ramah dn smoga awet laptop nya
Rara,5.0,Tempat rekomen terbaik jual beli laptop di jogja yang bergaransi resmi👍👍,2 years ago,0,Netral,Positif,rekomen baik jual beli laptop jogja garansi resmi
Meirizka,5.0,bagus!,3 months ago,0,Netral,Positif,bagus
Rizky Gusti,5.0,"laptop bekas berkualitass,MURAH dan ramah pelayanannya TENTUNYAA 🔥🔥",a year ago,0,Netral,Positif,laptop bekas berkualitassmurah ramah layan tentunyaa
Solihin Rifanto,5.0,Rekomend buat yang mau beli laptop mantap,a year ago,0,Netral,Positif,rekomend beli laptop mantap
Adden Yusgiantoro Putra addenyusgiantoro.2022,5.0,"Kualitas laptop nya bagus, pelayanan ramah",a year ago,0,Netral,Positif,kualitas laptop nya bagus layan ramah
Ilham,5.0,Toko laptop second terbaik dijogja menurut pengalaman saya 👌🏽👌🏽😁 stoknya like new smua,4 years ago,0,Netral,Positif,toko laptop second baik dijogja alam stok like new smua
faridatul hidayah,5.0,"Nyaman, pelayanan ramah",2 years ago,0,Netral,Positif,nyaman layan ramah
Alwahida Ahfi,5.0,"buat yang cari laptop disini aja, pelayanan ramah pastinya harganya terjangkau",3 years ago,0,Netral,Positif,cari laptop aja layan ramah pasti harga jangkau
Awwahun Halim (Halim_Zi),5.0,"Anda mencari laptop second tapi masih seperti baru?
Iya disinilah tempatnya laptop second yang berkualitas, dan owner juga ramah",3 years ago,0,Netral,Positif,cari laptop second iya tempat laptop second kualitas owner ramah
Rantih Amelia,4.0,"Pelayanan bagus, laptop nya juga bagus",9 months ago,0,Netral,Positif,layan bagus laptop nya bagus
Pemdes Lubuk seberuk,5.0,"Barangnya berkualitas, penjualnya ramah. Terbaik!",2 years ago,0,Netral,Positif,barang kualitas jual ramah baik
123_Rafi Arrazak,5.0,"laptop lengkap , yang jaga juga ramah ramah harga ramah di kantong, recommended 👈",10 months ago,0,Netral,Positif,laptop lengkap jaga ramah ramah harga ramah kantong recommended
RIZKI SISTHANNISA,5.0,pelayanan baik dan jelas,6 months ago,0,Netral,Positif,layan
Faishol Abyan Syarif,5.0,"Pelayanan ramah dan baik , cocok untuk yang mencari laptop bekas area jogja",3 years ago,0,Netral,Positif,layan ramah cocok cari laptop bekas area jogja
Norres Satyawira,5.0,"Mantab, laptop masih garansi panjang, masnya juga ramah dan enak buat sharing",3 years ago,0,Netral,Positif,mantab laptop garansi mas ramah enak sharing
Hafiidz Smansapa,5.0,Pelayanan cepat tanggap dan sopan recommended karena yang di jual laptop dengan spesifikasi bagus,3 years ago,0,Netral,Positif,layan cepat tanggap sopan recommended jual laptop spesifikasi bagus
Eko Nur Cahyo,5.0,Laptopnya mantep mantep disini 👍,3 years ago,0,Netral,Positif,laptop mantep mantep
kanaka ruth,5.0,"trusted guys, barangnya juga oke masih mulus, garansi, dan dapet bonus 😆😆👍",3 years ago,0,Netral,Positif,trusted guys barang oke mulus garansi dapet bonus
Kiseki Distro ID Sticker and Apparel,5.0,"Barang bagus, pelayanan ramah.. recommended bgt...",2 years ago,0,Netral,Positif,barang bagus layan ramah recommended bgt
Muhammad alfi Syahrir rahman,5.0,"Pelayanana ramah, tempat nyaman dan adem",a year ago,0,Netral,Positif,pelayanana ramah nyaman adem
yanuar perdana,5.0,"Pelayanan mantab, cari laptop bekas disini aja, kualitas A1",2 years ago,0,Netral,Positif,layan mantab cari laptop bekas aja kualitas a
Rafi Rahman,5.0,"laptopnya banyak + harga terjangkau, dapet diskon juga dari harga yg dipasang👍🏻👍🏻",a year ago,0,Netral,Positif,laptop harga jangkau dapet diskon harga yg pasang
Bagas Adhitama,5.0,pelayanan mantap dan sangat rekomended buat yang mau beli laptop,3 years ago,0,Netral,Positif,layan mantap rekomended beli laptop
Rosa Dwi Andini Putri,5.0,"Tempat nya nyaman, banyak koleksi laptop second tipe yang baru",2 years ago,0,Netral,Positif,nya nyaman koleksi laptop second tipe
Alfin budiana,5.0,ramah dan keren,a week ago,0,Netral,Positif,ramah keren
dialogue,5.0,Tempat beli laptop keren dengan harga yang cukup miring ditambah bonus. Keren 👍🏼👍🏼👍🏼,2 years ago,0,Netral,Positif,beli laptop keren harga miring tambah bonus keren
Bawazier Albanjari,5.0,"Pelayanan mantep, barang mantep.",7 months ago,0,Netral,Positif,layan mantep barang mantep
Exsan yuwandono,5.0,"Pelayanannya bagus banget, puas pol pokok.e",a year ago,0,Netral,Positif,layan bagus banget puas pol pokoke
Akmal Nafidz Lawdza'i Kusmayadi,5.0,Terbaik 👍👍👍,3 weeks ago,0,Netral,Positif,baik
anur hidayanto,5.0,"Pelayanan ramah, pilihan lumayan variatif, garansi juga.",2 years ago,0,Netral,Positif,layan ramah pilih lumayan variatif garansi
Afdika Permana,5.0,Aman dan terpecaya. Dan gampang konsultasi,8 months ago,0,Netral,Positif,aman terpecaya gampang konsultasi
Latif Surya alamsyah,5.0,"Mantap, Pusat laptop berkualitas., cs juga ramah banget...",2 years ago,0,Netral,Positif,mantap pusat laptop kualitas cs ramah banget
Diah Saniy Pramudita,5.0,"Penjualnya ramah banget, tempat jual laptop murah di Jogja, Worth It Bangetttttttttttt",3 years ago,0,Positif,Positif,jual ramah banget jual laptop murah jogja worth it bangetttttttttttt
Alfin budiana,5.0,ramah dan keren,a week ago,0,Netral,Positif,ramah keren
Denita frisky,5.0,"Pelayananya bagus, Laptop nya juga keren” masih bergaransi jugaa , 👍👍👍",3 years ago,0,Netral,Positif,pelayananya bagus laptop nya keren garansi jugaa
Rafi Rahman,5.0,"laptopnya banyak + harga terjangkau, dapet diskon juga dari harga yg dipasang👍🏻👍🏻",a year ago,0,Netral,Positif,laptop harga jangkau dapet diskon harga yg pasang
Friyo Souisa,5.0,Untuk Tempatnya Bagus dan Harganya terjangkau untuk Mahasiswa✨,a year ago,0,Netral,Positif,tempat bagus harga jangkau mahasiswa
RIZKI SISTHANNISA,5.0,pelayanan baik dan jelas,6 months ago,0,Netral,Positif,layan
Pita Dewi,5.0,Ngebantu bgt ini sihh,2 months ago,0,Netral,Positif,ngebantu bgt sihh
isnaini subkhi,5.0,Menjual laptop yg masih bergaransi resmi. Ini yg membedakan dg toko lain. Kerenn,4 years ago,0,Netral,Positif,jual laptop yg garansi resmi yg beda dg toko kerenn
Alfath Afdhal,5.0,bagus,4 weeks ago,0,Netral,Positif,bagus
Naufal Mas'ud,5.0,"mantap, pelayanan ramah harga bersahabat barang debes",3 years ago,0,Netral,Positif,mantap layan ramah harga sahabat barang debes
Royani Rahman,5.0,"Sangat worth it, kualitas barangnya bagus semua",a year ago,0,Positif,Positif,worth it kualitas barang bagus
Aqmal Safa Rifai,5.0,"Puas sekali belanja disini, penjaga tokonya ramah, asik",3 years ago,0,Netral,Positif,puas belanja jaga toko ramah asik
andreas salettia,5.0,"pelayananya sangat baik, dan ramah2 pokokya the best lahh🤩",a year ago,0,Positif,Positif,pelayananya ramah pokokya the best lahh
Rio Dwi Saganev,5.0,Toko laptop yang harganya gokil rekomended bgt pelayanan ramah,2 years ago,0,Netral,Positif,toko laptop harga gokil rekomended bgt layan ramah
Raken Abdurrozaq,5.0,"Mantap, harga bersahabat 👍",3 years ago,0,Netral,Positif,mantap harga sahabat
Faza Maulida Rahman,5.0,Banyak pilihan laptopnya,Edited 4 months ago,0,Netral,Positif,pilih laptop
Nico apriliantono,5.0,keren,a month ago,0,Netral,Positif,keren
Setia Bela Adi Nugroho XI IPS 2,5.0,Pelayanan sangat ramah dan harga terjangkau murah,a year ago,0,Netral,Positif,layan ramah harga jangkau murah
Rafi Dwi S R,5.0,Sangat recomended buat yang mau cari laptop spek tinggi tapi harga terbatass,3 years ago,0,Netral,Positif,recomended cari laptop spek harga terbatass
Nugroho Amrih Widodo,5.0,Sangat Ramah amanah barang mulus... Barangnya bagus2,a year ago,0,Netral,Positif,ramah amanah barang mulus barang bagus
Muhammad Fredy Andreansyah,5.0,mantab,a month ago,0,Netral,Positif,mantab
Fernando Redondo,5.0,"Laptop bagus, pelayanan ramah, pokoknya top cer buat toko ini",3 years ago,0,Positif,Positif,laptop bagus layan ramah pokok top cer toko
Simpran Purbantini,5.0,Recommended bgt buat yang lgi cari2 laptop second kualitas tinggi,2 years ago,0,Netral,Positif,recommended bgt lgi cari laptop second kualitas
Sang pejuang,5.0,"Rekomend, leptop berkualitas dan bergaransi, pelayanan sangat memuaskan",3 years ago,0,Netral,Positif,rekomend leptop kualitas garansi layan muas
Kristianto,5.0,"Pilihan laptopnya banyak, harga terjangkau,
mantapp👍🏻",a year ago,0,Netral,Positif,pilih laptop harga jangkau mantapp
Ayu Ratih,5.0,"oke banget, beli laptop second serasa baruuu👌🏻",2 years ago,0,Netral,Positif,oke banget beli laptop second serasa baruuu
Khuma Humsosi,5.0,Pelayanan ramah,5 months ago,0,Netral,Positif,layan ramah
Fuadatus Sholihah,5.0,"Tempat beli laptop spek bagus, harga terjangkau.",a year ago,0,Netral,Positif,beli laptop spek bagus harga jangkau
PO POO,5.0,Mantap,a month ago,0,Netral,Positif,mantap
Dyah Septi,5.0,"Sangat recomended, pelayanan nya juga sangat ramahh👍👍",2 years ago,0,Netral,Positif,recomended layan nya ramahh
Wahyu Budi Santoso,5.0,"Tempat beli laptop second yang recommended , dan pasti masih garansi resmi",a year ago,0,Netral,Positif,beli laptop second recommended garansi resmi
Dikra Sadoni,5.0,"Pelayanan ramah , tempat strategis , aksesoris komplit",2 years ago,0,Netral,Positif,layan ramah strategis aksesoris komplit
Syaifullah Alfaruq,5.0,"Pelayanan mantap, laptop 2nd berkualitas semua 👍",2 years ago,0,Netral,Positif,layan mantap laptop nd kualitas
Muhammad Idham Arafah,5.0,Rudi pernah beli laptop disini,2 years ago,0,Netral,Positif,rudi beli laptop
Pendet 11,5.0,"Bagus, dapet laptop gaming gahar mantap, tapi harga miring",Edited 11 months ago,0,Netral,Positif,bagus dapet laptop gaming gahar mantap harga miring
Hapy I,5.0,"Rekomend buat yg cari laptop second kualitas sangat bagus, disini ada banyak",3 years ago,0,Netral,Positif,rekomend yg cari laptop second kualitas bagus
Hasan Riyanto,5.0,"Barang istimewa.
Pelayanan super ramah.

Makasih mas.
Sukses teruss",4 years ago,0,Positif,Positif,barang istimewa layan super ramah makasih mas sukses teruss
Almaz Fiqri,5.0,"Nice shop, pelayanan sangat ok",a year ago,0,Positif,Positif,nice shop layan ok
Rizqi Firdaus,5.0,"REKOMEN TEMPATNYA, SAYANG CEPET HILANH BARANGNYA.

MANTEPPP LAHH",a year ago,0,Netral,Positif,rekomen tempat sayang cepet hilanh barang manteppp lahh
Ayu Ratih,5.0,"oke banget, beli laptop second serasa baruuu👌🏻",2 years ago,0,Netral,Positif,oke banget beli laptop second serasa baruuu
Sparepart Laptop,5.0,Agannya ramah..tempatnya nyaman..udh ga bisa bilang apa apa lagi..trusted lah,4 years ago,0,Netral,Positif,agan ramahtempatnya nyamanudh ga bilang lagitrusted
Rahma Dania Ayushinta,5.0,"Tempat nyaman, penjualnya ramah, ga nyesel beli disini 👍",4 years ago,0,Netral,Positif,nyaman jual ramah ga nyesel beli
Sarrah Natalia,5.0,"Pelayanan nyaman, barang oke👌
Sukses selalu Hero Computer Jogja😇",3 years ago,0,Netral,Positif,layan nyaman barang oke sukses hero computer jogja
Muhamad Hakim Saputra,5.0,Ramah rekomended,3 years ago,0,Netral,Positif,ramah rekomended
Adinda Willyana,5.0,"laptopnya bagus², pelayanannya ramah. recomended pokoknyaa👍👍👍👍",2 years ago,0,Netral,Positif,laptop bagus layan ramah recomended pokoknyaa
Rezky Amy,5.0,"Sangat recommended, pelayanan nya sangat ramahh👍👍",2 years ago,0,Netral,Positif,recommended layan nya ramahh
Damar Nurrahman,5.0,pelayanan baik dan ramah.. produk oke,2 years ago,0,Netral,Positif,layan ramah produk oke
Rasyid Ghoni Abdillah,5.0,"Mantapp  , Sangatt Ramahh , Pelayanannya  Ramah , Barangnya Jospar",3 years ago,0,Netral,Positif,mantapp sangatt ramahh layan ramah barang jospar
hafif okredi,5.0,"Pelayanan cepat, dan mas nya ramah pool",a year ago,0,Netral,Positif,layan cepat mas nya ramah pool
Didi Ahmad Mulya,5.0,Dapet legion di sini wkwk,5 months ago,0,Netral,Positif,dapet legion wkwk
Evan Pramudya,5.0,"Penjualnya ramah, pokoknya recommend bgt 👍🏻",2 years ago,0,Netral,Positif,jual ramah pokok recommend bgt
Mukminan Arief,5.0,"Recomended, lengkap dan ramah",3 years ago,0,Netral,Positif,recomended lengkap ramah
Rokhmad Syarifuddin,4.0,"Laptop nya bagus ,sesuai dengan harga ,lokasinya mudah dijangkau siip buat Hero Computer",2 years ago,0,Netral,Positif,laptop nya bagus sesuai harga lokasi mudah jangkau siip hero computer
Gilang Fathurrohman,5.0,Pelayanannya ramah serta di beri pengarahan sebelum memilih Joss.....,3 years ago,0,Netral,Positif,layan ramah arah pilih joss
Faisa Ardra,5.0,"Ramah, dijelaskan dengan baik, kualitas tidak mengecewakan",a year ago,0,Netral,Positif,ramah kualitas kecewa
Ananderra Faiz,5.0,"Laptopnya keren, mulus-2 like new, joss",a year ago,0,Positif,Positif,laptop keren mulus like new joss
DavinAlanDarma Davin,5.0,Laptopnya baguss baguss,3 months ago,0,Netral,Positif,laptop baguss baguss
Yustinus Paidi,5.0,Pelayanan yang sangat bagus dan barangnya istimewaaaaaa,2 years ago,0,Netral,Positif,layan bagus barang istimewaaaaaa
Muh Stefryadhi,5.0,"Mantap, harga harga murah bagi para mahasiswa",a year ago,0,Netral,Positif,mantap harga harga murah mahasiswa
Zulfi Risqi,5.0,"Owner ramah, pelayanan oke. Murah sepenjuru jogja",3 years ago,0,Netral,Positif,owner ramah layan oke murah penjuru jogja
23 Naufal Arif,5.0,Pelayanan ramah sama masnya gak pelit ilmu.,a year ago,0,Netral,Positif,layan ramah mas gak pelit ilmu
Agus Tiadi,5.0,"Mantap sekali
Ramah dan sabar",9 months ago,0,Netral,Positif,mantap ramah sabar
Pravayangastha,5.0,"Sangat memuaskan, pelayanan nya juga baik",2 years ago,0,Netral,Positif,muas layan nya
yusuf kurniawan,5.0,"Top, walaupun second laptopnya model baru semua",a year ago,0,Positif,Positif,top second laptop model
jus jambu,5.0,ramah,2 months ago,0,Netral,Positif,ramah
MUHAMMAD WISNU ADJI PANGESTU,5.0,"Barang sesuai, walau second masih keliatan likenew",a year ago,0,Netral,Positif,barang sesuai second liat likenew
Alssa Askfritho,5.0,barang bagus dan pelayanan toko ramah👌👍🏻,2 years ago,0,Netral,Positif,barang bagus layan toko ramah
Ronald Igor Raditya,5.0,"Pelayanan ramah, cepat, informatif, mantab pokoknya",a year ago,0,Netral,Positif,layan ramah cepat informatif mantab pokok
Abdul Aziz,5.0,"Pelayanan ramah, kualitas top, trusted, RECOMMENDED!",3 years ago,0,Positif,Positif,layan ramah kualitas top trusted recommended
Samsul Robi,5.0,"Pelayanan baik, good seller",a year ago,0,Positif,Positif,layan good seller
Febi Utami FU,5.0,"Pelayanannya cepat dan juga ramah ditoko ini,  harganya juga murah",3 years ago,0,Netral,Positif,layan cepat ramah toko harga murah
luqman hakim,5.0,"Mantaplah, rekomendasi buat para temen"" yang mau cari laptop 👍",3 years ago,0,Netral,Positif,mantap rekomendasi temen cari laptop
arka Arka,5.0,"Keren,kualitasnya bagus,pelayanan sangat baik",2 years ago,0,Netral,Positif,kerenkualitasnya baguspelayanan
Arni Kurnia,5.0,"Highly recommended, pelayanan ramah, kualitas produk okeee",3 years ago,0,Positif,Positif,highly recommended layan ramah kualitas produk okeee
ARGASYAH AHMAD AL KABIR,5.0,"Pelayanan Mantab, Barang like new harga 2nd",2 years ago,0,Netral,Positif,layan mantab barang like new harga nd
Angga Putra,5.0,Tempat nya nyaman dan mas nya ramah,10 months ago,0,Netral,Positif,nya nyaman mas nya ramah
marda tri setya,5.0,Sangat recoment banget buat 2nd likenews barang masih bagus..,3 years ago,0,Netral,Positif,recoment banget nd likenews barang bagus
Ilham Sudistiawan,5.0,Tempat pembelian laptop second yang sangat recommended.,a year ago,0,Netral,Positif,beli laptop second recommended
Muktafin,5.0,Mantabbb.. rekomended sekali..,2 years ago,0,Netral,Positif,mantabbb rekomended
Bebek Petarung,5.0,Tempat bagus buat nyari laptop harga terbaik di jogja,2 years ago,0,Netral,Positif,bagus nyari laptop harga baik jogja
Cheen Lee,5.0,"Jual laptop bekas tapi berkualitas, untuk harga bisa cari sesuai budget.",3 years ago,0,Netral,Positif,jual laptop bekas kualitas harga cari sesuai budget
Alif Haikal,5.0,"harga terbaik, pelayanan ramah, jos pokoke 👍🏻",3 years ago,0,Netral,Positif,harga baik layan ramah jos pokoke
Strawberry _,5.0,Tempat jual beli laptop jogja dengan garansi dan banyak pilihan..recommended👍,2 years ago,0,Netral,Positif,jual beli laptop jogja garansi pilihanrecommended
Aulia Rahman,5.0,bagus tempatnya,7 months ago,0,Netral,Positif,bagus tempat
Safri munthe013,5.0,Sangat rekomen untuk cari² laptop dana pelajar,a year ago,0,Netral,Positif,rekomen cari laptop dana ajar
Arfashad Izaz,5.0,"Toko Laptop Second Paling recomended, pelayanan paling poll top global",2 years ago,0,Positif,Positif,toko laptop second recomended layan poll top global
Muhammad Mahfudz,5.0,Tempat beli laptop second dengan harga murah dan kualitas yang baik.,2 years ago,0,Netral,Positif,beli laptop second harga murah kualitas
Ahmad Bilvan Firjatullah,5.0,mantap sekali gak nyesel jauh jauh dari magelang,a year ago,0,Netral,Positif,mantap gak nyesel magelang
Rahma Yulianto,5.0,Laptop nya berkualitas semua,3 years ago,0,Netral,Positif,laptop nya kualitas
Nopel Nop,5.0,"worth it, dan mulus mulus sih",7 months ago,0,Positif,Positif,worth it mulus mulus sih
Vivi Ulvia,5.0,"Kakaknya ramah, pelayanan baik...",a year ago,0,Netral,Positif,kakak ramah layan
subiyan toro,5.0,Membantu pemilihan laptop sesuai kebutuhan. Keren.,11 months ago,0,Netral,Positif,bantu pilih laptop sesuai butuh keren
Tuan Masker Gaming,5.0,Mantap pelayanan OK. Semoga barang aweet,3 years ago,0,Positif,Positif,mantap layan ok moga barang aweet
Gerardus Majella,5.0,mantap,2 months ago,0,Netral,Positif,mantap
kautsar arjuna,5.0,"Pelayanan josjis, harga merakyat, recommended pokoke👍",2 years ago,0,Netral,Positif,layan josjis harga rakyat recommended pokoke
Seno Basis Sampurno,5.0,Mantab,2 months ago,0,Netral,Positif,mantab
Chendana Saksono,5.0,"Toko terpercaya...
3 kali transaksi tdk ada kendala...",3 years ago,0,Netral,Positif,toko percaya kali transaksi tdk kendala
Andreas Hamdani,5.0,"pelayanan bagus, ramah👍🏻👍🏻",a year ago,0,Netral,Positif,layan bagus ramah
Rayhan Aswiansyah,5.0,Mantap laptopnya lengkap ya sip,3 years ago,0,Netral,Positif,mantap laptop lengkap ya sip
Ikhwani amirul,5.0,Hero computer jogja sangat rekomended bagi yang cari laptop dan untuk bagi pelajar atau mahasiswa👍👍,2 years ago,0,Netral,Positif,hero computer jogja rekomended cari laptop ajar mahasiswa
3668 _ Teddy Mukhasan,5.0,Pelayanan mantap dan cekatan. Harga murah dan terjangkau,2 years ago,0,Netral,Positif,layan mantap cekat harga murah jangkau
33_Muhamad Alfareza,5.0,Laptop yang dijual bagus bagus banget dan harga nya merakyat,2 years ago,0,Netral,Positif,laptop jual bagus bagus banget harga nya rakyat
Nur Khanita Ardiningsih,5.0,"Yhuks, mau konsul laptop kamu, mau tuker, mau beli ke HERO COMP ajah",2 years ago,0,Netral,Positif,yhuks konsul laptop tuker beli hero comp ajah
024_Gian Dany Fausta Hariq,5.0,yang butuh laptop second dengan harga miring sung kunjungi hero komputer jogjahhh,2 years ago,0,Netral,Positif,butuh laptop second harga miring sung kunjung hero komputer jogjahhh
muhammad niko,5.0,"Pelayanan ramah, recomended pokoknya 💃",a year ago,0,Netral,Positif,layan ramah recomended pokok
amas rofik,5.0,"Tempatnya nyaman, barang berkualitas😁👍",2 years ago,0,Netral,Positif,tempat nyaman barang kualitas
Widiyawati,5.0,Rekomendasi banget beli laptop disini 👍👍,10 months ago,0,Netral,Positif,rekomendasi banget beli laptop
Dani semprul 22,5.0,barang mantap rekomendasi sesuai kantong sukses terus,3 years ago,0,Netral,Positif,barang mantap rekomendasi sesuai kantong sukses
Desi Sunyahni Permatasari,5.0,Ramah dan bagus,7 months ago,0,Netral,Positif,ramah bagus
Sundaesign Collective,5.0,Puas dengan barang dan pelayanannya 👍🏻,a year ago,0,Netral,Positif,puas barang layan
Briandika Yusni,5.0,tempat lengkap mencari laptop pilihan anda..,a year ago,0,Netral,Positif,lengkap cari laptop pilih
Syahrul Ramadhan,5.0,pelayanan sangat bagus mantap,a year ago,0,Netral,Positif,layan bagus mantap
Bagas saputra,5.0,mantap kali wak beli laptop disini,a year ago,0,Netral,Positif,mantap kali wak beli laptop
Aufa Daffa,5.0,"Penjual ramah serta harga pun terjangkau, mantappp",3 years ago,0,Netral,Positif,jual ramah harga jangkau mantappp
Mutia Sholikha,5.0,"Dua kali beli di sini, fresh dari pemilik pertamanya, memuaskan",3 years ago,0,Positif,Positif,kali beli fresh milik pertama muas
Rheno Viktoria,5.0,"Mantap banget, penjual ramah, harga juga ramah. Kece banget",3 years ago,0,Netral,Positif,mantap banget jual ramah harga ramah kece banget
Noor Faiz Rasyid,5.0,Pelayanan ranah dan menyenangkan,8 months ago,0,Netral,Positif,layan ranah senang
Fardin Afif,5.0,"Cari laptop gaming second yang berkualitas dan masih garansi, cuman disini

Jaminan produk 👍👍👍👍",3 years ago,0,Netral,Positif,cari laptop gaming second kualitas garansi cuman jamin produk
Babuz Zaman,5.0,Produknya sesuai,10 months ago,0,Netral,Positif,produk sesuai
Iqbal Dzikrullah,5.0,"pelayanan bagus, harga terjangkau",a year ago,0,Netral,Positif,layan bagus harga jangkau
lusi ariani,5.0,"Pelayanan bagus, penjual sangat ramah 👍👍",3 years ago,0,Netral,Positif,layan bagus jual ramah
M Yusuf N,5.0,"Laptop berkualitas, harga terjangkau dapat bonus😁",a year ago,0,Netral,Positif,laptop kualitas harga jangkau bonus
muson kilat,5.0,Adminnya baik banget. Mau jelasin spek laptolnya satu2.,3 years ago,0,Netral,Positif,adminnya banget jelasin spek laptolnya
abimanyu,5.0,pelayanan sangat bagus 🤩,10 months ago,0,Netral,Positif,layan bagus
Cadan 07,5.0,murah,a week ago,0,Netral,Positif,murah
zen gamal,5.0,Pelayanan prima harga masih bisa senggol-senggol,a year ago,0,Netral,Positif,layan prima harga senggolsenggol
panji nugroho,5.0,"Enak pelayanan ny, enak tempatnya. Joss",3 years ago,0,Netral,Positif,enak layan ny enak tempat joss
Irianda Wahyu,5.0,Mantap lengkap,a year ago,0,Netral,Positif,mantap lengkap
Aditya Wahyu Pratama,5.0,"harga terjangkau dan kualitas good , terimakasih.",2 years ago,0,Positif,Positif,harga jangkau kualitas good terimakasih
M Rokhiqil,5.0,"Bakule ramah, bonus nya banyak, barang oke 🔥🔥🔥",2 years ago,0,Netral,Positif,bakule ramah bonus nya barang oke
Didik xlr,5.0,Produk sesuai ekpetasi. Mantap pokoke recommended jos!,3 years ago,0,Netral,Positif,produk sesuai ekpetasi mantap pokoke recommended jos
Ivansyah,5.0,"Garansi panjang, barang berkualitas, harga ramah dikantong...",3 years ago,0,Netral,Positif,garansi barang kualitas harga ramah kantong
Maulana Sadid,5.0,"Pelayanan sangat memuaskan, harga terjangkau",3 years ago,0,Netral,Positif,layan muas harga jangkau
luluk cantik,5.0,"Laptop Bagus dan original.
bergaransi resmi",8 months ago,0,Positif,Positif,laptop bagus original garansi resmi
Qonita Izzatunnisa,5.0,"Pelayanannya baguus, harganya oke, tempatnya juga nyaman",3 years ago,0,Netral,Positif,layan baguus harga oke tempat nyaman
Fina Indriana,5.0,"Mantapp pilihannya banyak, masnya informatif, harga juga miring 👍👍",2 years ago,0,Netral,Positif,mantapp pilih mas informatif harga miring
Dheony Danis Wara,5.0,"Mantap jiwa ramah, tempat nyaman bersih dan rapi",3 years ago,0,Netral,Positif,mantap jiwa ramah nyaman bersih rapi
Mahfud Risnansyah,5.0,"Good service, barang sesuai, harga bersaing",3 years ago,0,Positif,Positif,good service barang sesuai harga saing
Miftah Komar,5.0,"Ini five star, barang bagus bagus  ara araaa",a year ago,0,Netral,Positif,five star barang bagus bagus ara araaa
Muhammad Rendy Almustofa,5.0,Berkualitas banget ga salah pilih yg ini,2 years ago,0,Netral,Positif,kualitas banget ga salah pilih yg
Arya Yudha,5.0,Barangnya mulus,3 years ago,0,Netral,Positif,barang mulus
