nama_penulis,rating,teks_ulasan,waktu,likes
yussron,5.0,Recommended to find second laptop like new and good condition,a month ago,0
Bayu Prasetyo,5.0,Second laptop recomended secon like a new,3 months ago,0
Galuh Astika,5.0,👍,2 months ago,0
Gayuh Amukti,5.0,Recommended 👍🏼,2 months ago,0
SatriaDarma23 070,5.0,Recommend for all who want to buy newest laptop with affordable price!,2 years ago,0
Luqman Hakim,5.0,👍🏻👍🏻,5 months ago,0
Dewi Purnama Sari,5.0,Recommend for all who want to buy newest laptop with affordable price!,3 years ago,0
Haryo Dwi Pangestu,5.0,Decent place to shop and great service,8 months ago,0
Bizy_,5.0,Good price and humble,11 months ago,0
yulistasya Choirunnisa,5.0,kerenn,2 weeks ago,0
Abimanyu Bondan,5.0,Great place to search a second hand laptop with a mint condition,3 years ago,0
sela amelia mulyana,5.0,recommended place to buy a laptop👍🏻,a month ago,0
Akmal Hadrian,5.0,"Amazing eh, all the employees are really humble",9 months ago,0
Bebas sss,5.0,joss,a month ago,0
amanda pasha,5.0,good services and worth to buy,8 months ago,0
Annisa Cinta92,5.0,Best,2 weeks ago,0
Isma Nurfaizatinn,5.0,JOSSSSS,2 months ago,0
Kang cr Cr,5.0,GOOD,a month ago,0
Muhammad Jarod,5.0,The best place to find a laptop with the best price...,3 years ago,0
Anggi Surya Permana,5.0,"Nice places and nice price, recomend saller. Product high quality👍",3 years ago,0
mateus partono,5.0,best,8 months ago,0
Kholilur Ridwan,5.0,Rekomended for all who want to buy newest laptop with affordable price..,3 years ago,0
Nabila Febriana,5.0,nice,4 months ago,0
Radityo D,5.0,Best!,6 months ago,0
Oey Meng Hooy,5.0,Sip,4 months ago,0
Dewangga rystyo,5.0,good,6 months ago,0
Atadiia Asalam,5.0,Good place to buy leptop,8 months ago,0
Sarif Simki,5.0,The best,9 months ago,0
min alfin,5.0,"Good, recommended",3 years ago,0
Nor Ismah,5.0,recommended shop for buying a second hand laptop!,3 years ago,0
Siti Wahyuni,5.0,good best service 👍,a year ago,0
Nizar Fahlevi,5.0,"Good recomend, trusted",3 years ago,0
goddzi,5.0,nice service maszeh,3 years ago,0
galih S,5.0,trusted,3 years ago,0
Isti Nuraningsih,5.0,Nice ✌🏻,2 years ago,0
andra satrio,5.0,Mantap Recommended 👍👍👍,2 years ago,0
Ulfa Nur Azizah,5.0,The best place to buy a laptop 💯👍,3 years ago,0
ICHA WIDYA SARI,5.0,sangat recommended,2 years ago,0
Yusuf Firdaus,5.0,Well,9 months ago,0
Khoirul Ilham,5.0,Joss negone,2 years ago,0
ASDA 15,5.0,Recommended storee.....,3 years ago,0
Muhamad Amir,5.0,The best pokoe,a year ago,0
Aldin Nasrun,5.0,Best place to get a laptop,2 years ago,0
Anggi Permana,5.0,Great product,a year ago,0
Bagus Kuncoro jati,5.0,Ship,11 months ago,0
Jecika Arum,5.0,Good,a year ago,0
Habib Kurniawan,5.0,Best seller!,4 years ago,0
Dimasmakruf,5.0,gooddddfd,3 years ago,0
Farazdaq Azzahra,5.0,Nice,2 years ago,0
Shabrina Kusuma Wardhani,5.0,Recommended 👍,2 years ago,0
Fani Aditama,4.0,Good,2 years ago,0
Dimas Addien,5.0,Good !!,3 years ago,0
Bagas Surya,5.0,Good,2 years ago,0
Nisrina Salsabila,5.0,Very recommended!!!,3 years ago,0
Karee kar,5.0,recommended seller,3 years ago,0
Puji Astuti,5.0,Good,3 years ago,0
Kinanti Rindang,5.0,Good,3 years ago,0
Oki_Cahyadi Cahyadi,5.0,Good,3 years ago,0
SYAFIQ RIDHO,5.0,Well,2 years ago,0
S. Aji Nugroho,5.0,👍👍👍,2 years ago,0
Nurul Eka Kisya,5.0,Trusted,3 years ago,0
Yusuf Setiawan,5.0,recomendedd,2 years ago,0
Sintani Bekti,5.0,like,3 years ago,0
Novid Dwi Haryanto,5.0,Recommended,3 years ago,0
Maheswari Dian Argani,5.0,excellent!🔥🔥🔥🔥🔥🔥🔥🔥🔥🔥🔥🔥🔥🔥🔥🔥🔥🔥🔥🔥🔥🔥🔥,3 years ago,0
MUHAMMAD HIBZAH DASA OKKA,5.0,"Mantap, laptop mereka second hand tapi baramg seperti baru.
Karena mereka memang ambil laptop yang umurnya masih muda, saya beli laptop amd ryzen 7 tahun 2024, di harga 6,7 juta.
Pelayanan excelent, barang juga excelent.
Semoga awet",a month ago,0
Wafa Wardana,5.0,Terbaik. Pilihan utama laptop secondhand berkualitas. Dijelaskan oleh mas nya dgn sabar dan jujur. Offline store nyaman dan sejuk. Top markotop,4 months ago,0
Azka Rusyda Farsya Kusmayadi,5.0,"Beli laptop disini udah yang ke 2x nya udah beli 3 unit total, bagus banget tokonya, masnya juga informatif. Good Job!!",2 months ago,0
neviestaa,5.0,"Pengalaman belanja di Hero bener-bener memuaskan. Dari awal tanya-tanya, adminnya sabar jelasin detail laptop sampai akhirnya aku nemu yang paling pas sama kebutuhan kuliah. Prosesnya cepat, barang datang sesuai deskripsi, kondisi mulus dan ori. Harganya juga lebih bersahabat dibanding toko lain yang aku bandingin sebelumnya. Next kalau upgrade laptop, pasti balik lagi ke Hero",a month ago,0
Surya Ramadhani,5.0,"Barang-barang yang di jual bagus² dan masih pada mulus², tempet nya nyaman dan penjual nya pada ramah² dan sangat komunikatif",2 months ago,0
Muhammad Alfian Nurkholis,5.0,"Jual beli laptop second hand bagus.. Offline storenya nyaman, ber-AC. Pelayanannya pun bagus. Alhamdulillah dapat good deal juga 👍",2 months ago,0
Akmal Soffal,5.0,"Mantap pelayanan ramah, tempat bersih nyaman, unit banyak pilihan sesuai harga dan kebutuhan",2 months ago,0
Indira Surya,5.0,"Pelayanan oke
Barang ori masih garansi resmi
Sukses selalu",a month ago,0
Rosa Ochaa,5.0,"Konsultasi cari laptop untuk pekerjaan utama, akhirnya disini menemukan laptop second yg cocok, bagus, dan terpercaya.. untuk menentukan pilihan laptop dibantu oleh staf yg sangat komunikatif dan solutif..  di toko ini rekomendasi utama untuk cari laptop terumama bagi pekerja, mahasiswa, pebisnis, dll.. terima kasih hero computer 🙏😊",5 months ago,0
Fan Bs.,5.0,"Semua tersedia disini, pelayanannya juga bagus. Di kasih tau apa yang aku ngga tau. Dan harga juga termasuk harga yg bersahabat bgt.",a month ago,0
Aisya Hanum,5.0,sangat bagus. pelayanan sangat ramah sangat dibantu. tempatnya nyaman dingin. masnya sabar luar biasa. sangat ingormatif🤙🏻💪🏻,a month ago,0
Irma Novitasari,5.0,"Barang bagus dan kayak baru semua, setelah muter2 akirnya beli disini..mas Rudi seller baik, ramah dan sabar bgt ..good dech pokoknya",4 months ago,0
ida roikhanah,5.0,pertama kali beli laptop second di sini. dapet yang sesuai sama kebutuhan. mas nya yg jaga jelasinnya sabar banget,3 weeks ago,0
Furqon Ahmad Fauzi,5.0,"Alhamdulillah dapet laptop spek bagus dan sesuai kebutuhan, karena disana di paparkan sesuai request pelanggan, jadi enak, bonus juga mouse, tas laptop, kena diskon juga sii,hehe...makasih Hero Computer, semoga laptopnya awet ya.aamiin",5 months ago,0
Sad Polaris,5.0,"Barusan beli latop disini, dan jujur puas banget! Dari awal tanya-tanya, adminnya fast respon dan sabar jelasin. Pilihan laptop banyak, harganya juga oke banget dibanding tempat lain. Proses kirim cepet, laptop langsung nyala tanpa masalah. Pokoknya recommended banget buat yang mau cari laptop tanpa ribet!",5 months ago,0
Alfiyan Fadly,5.0,"Pelayanan ramah, barangnya masih bagus bagus, akses sangat mudah... Saya udah muter2 cari lp bakas tapi yang cukup lengkap cuma di sini",5 months ago,0
Budianto Haris,5.0,"Pelayanan ramah, harga naiss, rekomended sekali untuk nyari laptop second berkualitas dan yg jelas harga menarik",4 months ago,0
fikhri ardiansyah,5.0,"Tempat nyaman, stafnya sabar jelasin spesifikasi laptop, cocok buat yang kurang paham teknologi",a month ago,0
Agung Febri,5.0,"Hero computer emang recomend buat kantong² menengah pelayananya ramah,juooossss pokoke",a week ago,0
Joshua Mayong,5.0,"Tempat terbaik untuk beli laptop second. Pilihannya banyak, tempatnya nyaman, dingin dan sangat bersih, laptop juga dalam kondisi yang baik semua. Karyawan yang menjaga sangat informatif dan membantu mencarikan sesuai kebutuhan dan sesuai dengan dana yang dimiliki. 10/10 👌🏻",3 months ago,0
h,5.0,"laptop di sini masi baguss semua kualitas juga oke bgtt, recommend buat yang butuh laptop second like new & harganya yang pasti worth it",2 months ago,0
Monicha Herwinda,5.0,"pelayanan sudah sangat baik, untuk laptop sangat bervariasi dan terlihat seperti baru👍🏻",a week ago,0
Danilo,5.0,"Pelayanan bagus, ramah, tempatnya nyaman, terbaik. monggo kesini",a month ago,0
Realisca Agastha,5.0,"tokonya lengkap, harganya affordable, pelayanan ramah, the best laah pokonya",2 weeks ago,0
Danang Prasetya,5.0,"Pelayanan bagus,sat set semua dijelasin sampai detail. Bakal langganan disini.",2 months ago,0
Putri Anggitasari Husna,5.0,Salah satu rekomendasi tempat untuk beli laptop second di Jogja. Staffnya ramah dan informatif. Pilihan laptop juga banyak dan keluaran terbaru.,5 months ago,0
Ahmad Rodhi,5.0,"Pelayanannnya ramah, laptop dengan harga yang sangat terjangkau, dan tempat nyaman juga. Pokoke muantab poolll👌👌",2 months ago,0
Rahmawati Ratnadila,5.0,"Pelayanannnya ramah, staffnya sangat detail menjelaskan semua produknya. Rekomend untuk teman teman yg mau cari laptop kerja atau kuliah. Staffnya akan menjelaskan detail semua laptop yg kita butuhkan",5 months ago,0
Adhie Azzuri,4.0,"Pelayanan nya oke..mas e yg jaga mas e yg punya toko ramah...

Ac e adem tenan mas...",2 months ago,0
Ahmad Nur Aly,5.0,"Toko laptop gaming second recommend di Jogja, unit baru2. Masnya ngasih penjelasan lengkap.
jangan ragu beli di sini.",a month ago,0
Hasna Ningrum,5.0,"Beli laptop disini terbaik, pelayanannya sangat ramah masnya menjelaskan dengan sangat sabar tempatnya juga nyaman. 🌟🌟🌟",a month ago,0
nadia,5.0,"Tempatnya mudah ditemukan. Selain itu, banyak pilihannya dan pelayanannya top karena setiap pertanyaan selalu dijawab dengan jelas dan komplit. Thank you hero computer 🤘🏻🥰",3 months ago,0
Aprilia Safa nurmaulinda,5.0,Penjaga toko nya ramah dan menjelaskan spesifikasi sesuai kebutuhan pembeli dengan jelas,a week ago,0
Rendy Ady,5.0,"Laptopnya bagus,harga bersahabat,,
Recommended banget pokoknya,,",3 weeks ago,0
Rahva Triliana Agista,5.0,tempatnya nyamann!!! kualitas laptop yang dijual juga oke banget!!! ga nyesel beli disini!!!,a month ago,0
Aufa Rift,5.0,"pelayanan baik, harga terjangkau, kualitas ga diragukan, mantep pol rek",2 months ago,0
Usamah Assholihin,5.0,"Sangat recomended buat jual/beli laptop, khususnya area sleman dan sekitarnya. Pelayanannya baik dan ramah.",4 months ago,0
Coen Xenon,5.0,"""Pelayanan di sini sangat bagus dan interaktif! Stafnya ramah, sabar menjelaskan, dan membantu memilih laptop yang sesuai kebutuhan. Proses pembelian juga cepat dan nyaman. Sangat direkomendasikan!""",7 months ago,0
Fahmita Elma,5.0,"Sangat bagus,pelayanannya ramah dan laptopnya masih oke oke. Recommended buat orang jogja yg mau cari laptop.",3 months ago,0
Muhammad Hafiz,5.0,"Pelayanannya sangat oke dan benar-benar ramah, mereka juga sangat memberikan support apa yang kita butuhkan, saya merasakan hubungan bukan dengan pembeli dan penjual melainkan serasa saudara, karena mereka memang sangat ramah.",6 months ago,0
Muhammad Afkaar Riqqat,5.0,pelayanan sangat ramah dan stok laptop sangat melimpah cocok untuk maba yang sedang mencari laptop,a month ago,0
Patria Agiska Diyose,5.0,"Barang bagus, rekomended untuk yg cari laptop second, tempat nyaman, pelayanan ramah",2 months ago,0
Riski ananda p,5.0,"Pilihan laptop secondhand berkualitas,bagus.  Offline store nyaman dan sejuk. Top markotop👍👍👍 pokonya mantap",4 months ago,0
Azis Turindra,5.0,"Alhamdulillah pelayanannya memuaskan, bisa konsultasi dan bisa disesuaikan sesuai budjet, dan yang pasti laptopnya keluaran tahun muda",6 months ago,0
Ahmad Ali M,5.0,Toko laptop murah. Lengkap bergaransi. Pokoknya laptop mulus banget pelayanan mantap,2 months ago,0
Yusuf Muhammad,5.0,Recomend bgt buat cari laptop spek bagus dan murah,a month ago,0
imankend,5.0,"Service memuaskan, Terima jual beli laptop dengan harga yang cocok👍🏼. thanks hero laptop💯",5 months ago,0
Ermina Pradipta,5.0,"Rekomendasi tempat beli laptop di jogja ni, barangnya oke oke, yang jual ramah juga👍👍",a month ago,0
Bintang Akb,5.0,"beli disini memuaskan, cs nya enak bisa konsultasi online maupun offline",2 months ago,0
Dzaki Muh,5.0,Toko bersih rapih dan layanan nya ramah,a month ago,0
wahyu ismoyojati,5.0,"Sdh lama cari laptop second berkualitas, spek oke, tipis dan ringan. Rutin mantengin update story di IG, siapa tahu ada yg cocok.
Nah..hari ini liat story, ada yg memikat.
Staf di WA respon cepat..
Dikrim foto2 unit,,cocok lanjut bayar, transfer..
Sy minta paketkan sja, jogja MACET 😂
Terima kasih hero computer.
Sy tunggu kedatangannya..
Semoga Laptop sampai Aman, Lancar, Awet dan Amanah😁",6 months ago,0
Hilmi Miftahzen Reza,5.0,"Pelayanan ramah, own nya menjelaskan detail sesuai kebutuhan laptop yang pengen tak beli. Sukses berkas selalu, Hero Computer. Semoga rezekinya nular.",7 months ago,0
Ibnu Abdul aziez,5.0,"Pelayanan mantap, produknya rekomended, tempatnya bersih estetik",a week ago,0
Irma Novitasari,5.0,"Goods banget barangnya, serasa beli laptop baru harga second, makasih seller",4 months ago,0
Harjanto Official,5.0,"Pelayanan ramah, harga cocok",a month ago,0
zen oktaviani,5.0,"Pelayanan memuaskan, pilihan variasi laptop banyak, harga juga terjangkau. Mantab",5 months ago,0
Tashya Pembayun,5.0,"Pelayanannya ramah, proses transaksi cepat, dan barang sesuai deskripsi. Laptop dalam kondisi mulus, lengkap. Recommended banget untuk yang cari laptop berkualitas!",a month ago,0
Witri Nur Anisa,5.0,"Beli laptop buat kebutuhan admin store, pelayanan gercep dan bagus sih. Produknya juga okee, pokoknya rekomen bgt buat yg mau cari laptop second di Jogja!",7 months ago,0
Suwiknyo Arif,5.0,"Barangnya rekomended dan harga murah tpi bukan murahan, terbaik se jogja pokoknya!!",3 months ago,0
Daniel Alfarizqi,5.0,"pelayanan baik dan ramah, tempatnya bagus & nyaman, modelnya banyak, dapat bonus✨",a month ago,0
Reginna Naufal Daaniys Supriono,5.0,"Pelayanannya bagus, kalo Konsul dijelasin detail banget, rekomen bgt buat beli kesinii, apalagi buat yg ga begitu paham laptop pasti dibantu",a month ago,0
Joseph Gerung,5.0,pegawai nya ramah sekali terus dijelaskan secara detail semua jadinya mudah dimengerti dan laptop nya lengkap sekali,a week ago,0
Daffa Nurussofa,5.0,"pelayanan terbaik di Hero Computer, recommend untuk mahasiswa yang mau cari laptop second harga terjangkau 👍👍👍",4 months ago,0
Hakiki FaturrahmanAs,5.0,"mantabb barangnya keren2, beli bekas serasa beli baru. Dan pelayanannnyaa sangatt baguusss, mas mas nyaa gercepp dann ramahhh selaluu fastt responn, barang barangnyaa jugaa lengkap dan baikk banget🙏🏻🙏🏻🙏🏻",8 months ago,0
Faiz Ilham,5.0,"Pelayanan terbaik, penjualnya menjelaskan detail2 dengan bahasa yang mudah dipahami, rekomended buat teman teman yang mau beli laptop tapi bingung dengan spek yang terlalu banyak, bisa langsung datang ke toko",a year ago,0
orion reno,5.0,"Pelayanannya Ramah, bisa tanya tanya langsung juga sama spek laptop yang mau dibeli dan harganya terjangkau",7 months ago,0
Radhitya Putra Neindar,5.0,"banyak variasi laptop yang tersedia, penjaga toko juga ramah ramah dan baikkk sekali..",3 months ago,0
Dhewi Nurhayati,5.0,"Pelayanan oke, laptop lengkap dan sangat direkomendasikan untuk pembelian laptop second dg kualitas tinggi",6 months ago,0
Azzam Rabbani,5.0,"Pelayanan ramah, bebas tanya"", banyak pilihan laptop yg harganya sangat terjangkau. tempatnya enak nyaman",3 weeks ago,0
Akid Fauzi,5.0,Rekomen laptop sacond wajib borong sbelum stok habis✨,2 months ago,0
farra shaesha,5.0,"pelayanannnyaa sangatt baguusss, kakak kakak nyaa gercepp dann ramahhh selaluu fastt responn, barang barangnyaa jugaa lengkaapo dann baikk banget dikasihh free giftt dan diskon juga, thank youuu🙏🏻🙏🏻🙏🏻",10 months ago,0
Yehezkiel Samudrananda,5.0,"pelayanan sangat baik, diberikan opsi untuk unit yg sama dengan yg dicari dengan perbandingan yg jelas. offline store juga nyaman dan posisi strategis. sangat recommended utk yg cari laptop 🤙🏻",5 months ago,0
Akita Rheanita,5.0,"good place, barangnya bagus2 pol",a month ago,0
Deva Rivaldy,5.0,"Sangat recomended buat jual/beli laptop, khususnya area sleman dan sekitarnya. Pelayanannya baik dan ramah.",2 weeks ago,0
Yasinta Astrid Susanti,5.0,"thankyou hero computer😊 pelayanan ramah, detail, dan worth it for unitnya 🙏🏻",3 months ago,0
Amri Abdil Wahab,5.0,"Pelayanan bagus, pas banget nyari laptop yang di pengen, dan lagi dalam perjalanan menuju toko",2 months ago,0
Nashrul Aziz,5.0,"Pelayanan premium seperti barang²nya.

mantaps, banyak diskon, dicek didepan mata pembeli dan semua barangnya oke, mulus dan lulus semua 🤩",3 months ago,0
- Aril,5.0,Mantap lah pokoknya,2 months ago,0
Salman Ridho,5.0,"Tempat jual beli laptop second hand bagus.. Offline storenya nyaman, ber-AC. Pelayanannya pun bagus. Alhamdulillah dapat good deal juga.",a month ago,0
Lilih Umbara,5.0,"Laptopnya, bergaransi dan terkurasi dengan baik.",a month ago,0
Aditya Pratama,5.0,Kalo butuh laptop second langsung ke Hero Computer saja kawan 👍,a week ago,0
Belva rifa Jafier,5.0,mantapp laptop gaming di harga miring a1 no debat💯💯💯,a month ago,0
Radhitya Ivan,5.0,"Pelayanan sangat ramah bagi yang nyari laptop rekomendasi bgt nih, detail ketika menjelaskan laptop sesuai kebutuhan saya",7 months ago,0
Muhammad Aprian,5.0,"Pelayanan sangat oke,tempat bersih
dan dapat potongan harga lagi🫵🏻 pokoknya best",6 months ago,0
Suci Purnamasari,5.0,"Pelayanan memuaskan serta sangat informatif
Barang barang sangat bagus",6 months ago,0
Kamado Tanjiro,5.0,"Tempat rekomendasi untuk jual atau cari laptop second dijogja,, pelayanan ramah, detail ketika menjelaskan laptop sesuai dengan kebutuhan yang kita cari😁",7 months ago,0
FIM 77,5.0,"Cari second laptop paling sip disini, lengkap banyak pilihan, harga menarik",4 months ago,0
Fitri NP,5.0,"Tempat cari gadget recomended banget, khusunya laptop. Aku cari laptop second disini, dibantu kasih rekomendasi sama mas mas pegawainya. Pelayanan super ramah, dan sangat membantu menentukan pilihan.
Harganya sangat bersaing dibanding toko lain, kalau cari yang garasi resmi masih on juga ada. Pokoknya disini siapa cepat dia dapat, baeang incaran cepat sekali terjualnya
Terthe best lah",3 years ago,0
AYU NINGRUM,5.0,"Tempat nya adem, pilihan banyak, mas e ramah, BISA NEGO 🤩",3 months ago,0
Haidar Shiddiq,5.0,"harga terjangkau diskon banyakk, pelayanan ramahh",3 months ago,0
MUHAMMAD WAHID NASHRULLOH,5.0,bagus deh buat yang lagi nyari laptop second murah di jogja recommend banget,5 days ago,0
Eniek Nawarsih,5.0,"pelayanan ramah, laptop murah berkualitas",6 months ago,0
Rahmatika Marsaoli,5.0,"Untuk kakak-kakak yang jualnya baik dan informatif sekali, tempat nyaman dan sejuk🌻",5 months ago,0
isyi,5.0,"servis okeee, barang bagus mulus. mantaplah 👍🏻👍🏻👍🏻",3 weeks ago,0
Daniel Alfarizqi,5.0,"pelayanan baik dan ramah, tempatnya bagus & nyaman, modelnya banyak, dapat bonus✨",a month ago,0
Rifki,5.0,"Gudangnya laptop bekas berkualitas rasa baru. Adminnya ramah banget, ada garansi juga. Pilihan laptopnya juga banyak. Gudangnya laptop spek dewa harga murah. Pokoknya rekomended banget. Saya kesini, adminnya sampai beliin es jeruk saking ramahnya. Keren deh.",a year ago,0
Reyhan Sty,5.0,Cari laptop murah kualitas premium!,a month ago,0
Nining Rahmala,5.0,"Pelayanannya ramah,, tempatnya nyaman, tokonya amanah, tempat jual laptop second Ter rekomended",2 months ago,0
Hendra Hendrawan,5.0,Jauh jauh ke sini dari Ponorogo Alhamdulillah dapat barang sesuai yang diinginkan dengan budget yang sesuai,4 months ago,0
Yusuf Rahmatullah,5.0,"Unit mantap, like new, pegawai ramah...",4 months ago,0
faisal adnan,5.0,Balik lagi ke hero buat beli laptop incaran ternyata sudah laku wkwk. Alhamdulillah dapet laptop lain di harga yang cukup mirip dengan sebelumnya.👍👍,2 months ago,0
Bagas Fawaz D,5.0,"pelayanan ramah, barang sesuai yang di inginkan, recommended",3 weeks ago,0
Well Dude,5.0,"Good service, laptopnya like new, dapet bonus jugaaa 10/10",6 months ago,0
Aqsha Laorens Umami,5.0,"pilihan laptop terpercaya, bagus, dan pastinya juga original serta pemakaian bisa jangka panjang. Jangan lupa berbelanja disini guys.",3 months ago,0
Dinda Ajeng Prastika,5.0,"Jual beli laptop bekas tapi kualitas berkelas 👍🏻. Beli laptop masih garansi officialnya 2 tahun, abis tu dapet potongan 100rb/new mouse. Masnya juga ramah dan membantu banget",a year ago,0
Ali Suranto,5.0,"pelayanannya ramaah, dibantu buat cek cek sepesifikasi dan pertanyaan pertanyaan di jawab dengan baik",6 months ago,0
Manyus Mariyanto (Rian),5.0,"Bagus pelayanan nya,, buat kita yg awam dibantu penjelasan spek laptop nya 🔥",2 months ago,0
Thofa Jr,5.0,"Laptopnya kualitasnya ok
Beberapa transaksi disini tidak pernah bermasalah",4 months ago,0
Muhammad Fariz,5.0,"Tempat cari laptop second recommended.
Pelayanannya ramah, tempat nyaman. Lengkap sekali laptop dari range harga berapapun ada.",3 months ago,0
Heni Listya,5.0,"Bagus, pelayanan ramah recommend untuk yg mau cari laptop kerja maupun buat kuliah",2 months ago,0
Dean Asmara,5.0,"Nyaman, cepat, tertata, dan bisa cari spek laptop yg sesuai juga",a month ago,0
apti alimah,5.0,"Good place, banyak pilihan laptopnya , barangnya masih bagus, mas nya ramah jugaa",2 months ago,0
Soulbit Yoga,5.0,"Pelayanan baik terbuka konsultasi via chat atau kunjungan di storenya langsung. Produk laptop oke punya, mantap deh. Langsung beli 2 unit, tinggal makin dibanyakin stoknya ya, biar makin banyak pilihannya juga 👍",11 months ago,0
MUHAMMAD YUSUF RAHARDIAN,5.0,"Pelayanan terbaik, harga terbaik",a week ago,0
Annas Rizky Julyanto,5.0,"Kualitas barangnya bagus, rekomend untuk yang mau cari laptop second atau baru dan tempatnya nyaman",2 months ago,0
Muhammad Annur Rizal,5.0,ada nomor WA yang bisa dihubungi ga min hero computer? Takutnya banyak penipuan yg mengatasnamakan hero computer,2 months ago,0
Aldi Muhamad Rizqi,5.0,"Pelayanan mantap, barang berkualitas dan ada promo menariknya... bintang 5 pokoknya",10 months ago,0
Winda Dwi Lestari,5.0,"Tempat beli komputer second yang sangat recomended. Tersedia banyak pilihan laptop second tapi fisiknya masih sangat bagus, dan spesifikasi mantap generasi terbaru. Sukses terus hero.",a year ago,0
Muhammad Nur Prasetyo,5.0,Tokonya rekomended banget buat yg mau cari laptop gen baru & garansi resmi,a year ago,0
Ayu Listia Arifin,5.0,pelayanannya baikk kakanya ramah poll dan dapet diskonn juga😻🫰🏻,a month ago,0
Sigit Meliyanto,5.0,"Top, beli online , ga perlu cek barang langsung udah dijamin bagus pol..",2 weeks ago,0
Widi Setyawan,5.0,"Aman dan cukup lengkap, sekarang tempatnya lebih nyaman dan agak luas",6 days ago,0
Dona Setya Nuraini,5.0,"memuaskan, saya beli laptop disini, mas masnya informatif dan ramah",6 months ago,0
Stefan Dhev,5.0,"Toko tempat beli laptop bergaransi dan terpercaya, unit looks good, performa bagus, harga terjangkau untuk spek dikelas masing masing",2 months ago,0
Akul Gama,5.0,"Baru coba pertama kali, pilihannya laptopnya banyak. Semoga cocok biar jadi langganan kalau suruh cariin untuk kantor lagi",3 months ago,0
Ahmad Farizal,5.0,"Mau beli laptop second berkualitas disini aja tempat nya, dijamin paling murah se Yogyakarta👍👍👍",a month ago,0
Stevanus Dannydra Prasetyo,5.0,"Saya beli disini 10 unit untuk perusahaan saya , udah jalan 2 tahun masih okee . Makasi bang owner 🔥",Edited a year ago,0
Najwah Ariella Puteri,5.0,Jual-beli laptop yang recommended 👍🏻 laptopnya masih bagus dan pelayanannya juga ramah. Pokoknya kalau mau beli laptop second di sini gak usah ragu 👍🏻,4 months ago,0
Dede Hardiansyah,5.0,"Kualitas baguss, harga bisa nego ada diskon juga di hari wekkend",a month ago,0
Rio Ardiyansyah,5.0,Pelayanan nya bagus… Harga nyaa untukk Laptop Spek Gaming Tipis tipis masih okee buattt di kantonggg,3 months ago,0
Galuh Alfian Effendi,5.0,Unit bagus lengkap pelayanan ramah Top,5 months ago,0
anisah ainiromadhoni,5.0,"makasih...
habis beli disini.  Semoga awet.  Aamiin",5 months ago,0
IndraSurya Bargo,5.0,Barang bagus ori semua..  laptop model² baru... Harga bisa di nego,a month ago,0
TM_Hasbi Firmansyah,5.0,"pelayanan ramah, unit masih bagus semua, rekomend bgt buat cari laptop",7 months ago,0
Jamil Masykuri,5.0,"Masnya ramah, ada tambahan instal office, barang bagus",a month ago,0
Heny Agustiyani,5.0,"Banyak pilihan unitnya dan dapet diskon, staf membantu dan ramah, tempatnya adem dan bersih.",7 months ago,0
Arimbi Arum Sw.,5.0,"Pelayanan super ramah, kualitas laptopnya masih bagus2. Rekomen kalau mau nyari laptop second disini",11 months ago,0
Pur Rakhmatul Barri,5.0,"Tempatnya nyaman, pelayanan jg cepet. ~Nemenin teman kantor beli laptop",4 months ago,0
Dimas Andreansyah,5.0,"Tempat, dan pelayanannya sangat bagus. Laptop disini lengkap, dan dalam kondisi yang baik.",10 months ago,0
Rofiq Mubarok,5.0,Salah satu rekomendasi tempat untuk beli laptop second di Jogja. Staffnya ramah dan informatif. Pilihan laptop juga banyak dan keluaran terbaru.,3 months ago,0
Leny Hartasya Agustin 05,5.0,"Pelayanan memuaskan, laptop masih bagus bagus",a month ago,0
Abram Dewantoro,5.0,"Offline store dari ignya : laptopbekasyogyakarta.id bekas berkualitas, barangnya manteb manteb, mantau terus ignya tiap ada postingan baru, kalo ngga cepet cepet nge booking bisa keduluan orang lain, hasil buruan pun dapet disini tuff f15 jauh lebih hemat dari beli baru, padahal barang 98% like new",3 years ago,0
Andri Aprianto,5.0,Mau cari laptop bekas ya diHERO computer tempatnya jual beli tukar tambah juga bisa dilayani dengan staf2 yg ramah,3 months ago,0
Budi angrh,5.0,"Alhamdulillah pelayanannya memuaskan, bisa konsultasi dan bisa disesuaikan sesuai budjet, dan yang pasti laptopnya keluaran tahun muda",5 months ago,0
Aziz Kurniardi1,5.0,"mantap pelayanan baik dan responsif, rekomended",a month ago,0
Jihad Maruf,5.0,"Pelayanan , oke , harga terjangkau , sip pokoe",6 months ago,0
M. Gaudienzo Lorenzo Puling,5.0,"Tempatnya aman dan nyaman, petugasnya sangat membantu dan bisa tawar harga yang terbaik pula.",4 months ago,0
