nama_penulis,rating,teks_ulasan,waktu
ena febriani,1,"Pelayanan kasa ga profesional, jutek banget, belanjaan saya rusak sampe rumah, frozen food ga diplastikin lagi, food & nonfood di gabung.",setahun lalu
Bagus Wicaksono,5,"dudu Mirota Godean Iki, torr Mirota mbantul ",setahun lalu
Dessy Riyani,4,"Tempat belanja kebutuhan groceries yang lengkap. Dari baju, perlengkapan dapur, bahan makanan frozen, fresh dan snackbpun lengkap. Tempat lumayan luas, bersih dan tertata rapi. Parkiran mobil ada dibelakang mirota.
Habis belanja mau yang seger2 juga ada beberapa foodcountainer  dibelakang dan juga ada chatime di pintu masuk depan.
Tempat strategis, mudah ditemukan.",setahun lalu
Tri Ratma,1,"Bbrp kali nemui barang yg beda harga antara rak dan nota.. Terutama untuk yg promo, harus jeli cek harga dinota, kenapa bisa terulang terus beda harganya. saya merasa dirugikan krn saya belanja langsung banyak tp ternyata harganya ggk sama .Sudah chat cs tp tdk diberi solusi. Untuk yg sblmnya masih mau ganti selisihnya, tp kali ini tdk. Sayang sekali",setahun lalu
Akhinul Anjaswati,1,"Pelayanan kasir attitude nya jelek bangettt , perkara donasi 100 rupiah aja sampe banting2 laci kasir , nutup lacinya juga didorong keras banget sampe saya reflek bilang ""kasar banget"" , dan dijawab sama mbak nya ""iya"". ...tanpa permintaaan maaf ..sumpah bikin bete ..masih pagi udah emosi2 aja ,,

Kenapa saya gak mau donasi , karena saya belanja ini buat kantor saya ,dan nota wajib sesuai dengan belanjaan
..
Sangat menyebalkan 

Kasir (dinota) Dyah arum",setahun lalu
Macan Putih,5,Barang barang untuk belanja rumah tangga ya terbilang lengkap dr harga yg terjangkau hingga mahal semua tersedia saya mencari produk yg saya inginkan tapi gak ada di Mirota kampus,Diedit setahun lalu
Gilang Farlyawan,5,Seger bgt,setahun lalu
Sulamin Sulamin,5,Enak rasanyaa banget,setahun lalu
gisela deigratia,2,"dikelola lebih baik lagi dong parkirannya, tiap tanggal muda selalu kacau tiap mau parkir, penuh tp ga diarahin sm petugas sampe antriam mobilnya panjang banget",setahun lalu
Meri Puspita Sari,1,Pelayanan buruk. Kasir yang nimbang buah kalo gak bisa melayani gak usah di suruh kerja,setahun lalu
Ais Irbah,5,"lengkap! sering belanja disini karena udah terbiasa disini huhu, lokasinya sebenernya strategis tapi karena di Jl. Godean rame, harus ekstra hati-hati sih. banyak bgt promonyaa!",setahun lalu
Barikoh Shinta Dewi,3,"pengiriman online lamaaaa sekali, pesan jam 11, jam 2 belum sampai jugaaaaa. ga ada estimasi sampainya ga bisa dikira kira. tau gitu mending beli langsung. TOLONG DITINGKATKAN LAGI UNTUK PENGIRIMAN ONLINE NYAAA. sangat merugikan saya mau masak siang jadi belum makan sampai mau sore seperti ini.

edit: dan jam 3 baru dikonfirmasi pesanan dikirim, maaf ya mirota saya baru pertama kali pesan dikasih first impressions yang kurang enak. Kedepannya tolong lebih baik ya, agar tidak ada pelanggan kecewa",setahun lalu
Inna KusumoLaminingtyas,5,Enak bgt chatimeny,setahun lalu
Muhammad Alif Fathullah,5,"The best store to get anything you want for your daily necessities. Food and drinks, fruits, house appliances, clothes and trousers, even you can buy study essentials for your school.",setahun lalu
Anita Dwi Aryani,4,"Pilihan belanja bulanan favorit, harga murah & lengkap. Hanya saja antrinya cukup panjang, bisa sampai ditengah-tengah etalase barang pada awal bulan, sehingga cukup mengganggu pengunjung yang memilih barang.",setahun lalu
JC Frank,4,Bagus cuman banyak barang yang habis,setahun lalu
Anggoro Irwan Susanto,5,Tempat belanja keluarga,setahun lalu
Novita Anggraeni,4,"MT lokal langganan orang jogja. Saran saya kalau mau belanja di sini jangan pas awal/akhir bulan momen orang-orang gajian, karena pasti membludak, gang antar rak kecil jadi pasti jadi gang senggol. Luasnya lumayan, di atas masih ada baju-baju. Sayurab standar tidak segar-segar amat ga layu juga, buah juga demikian. Promonya kadang lumayan kadang standar juga sih. Parkiran ada depan belakang. Awal ke sini kegojek karena dikira parkir mobil cuma depan. Ternyata belakang ada. Ada cha time, ada atm juga di sini",setahun lalu
Fredika Benz,5,"Tempat belanja kebutuhan bulanan yang lengkap dan bisa dikatakan komplut. Tempat ademm, terang, nyaman, luas, bersih, barang nya huga tertata rapi memudahkan saat berbelanja. Harga sangat bersaing. Parkir juga mudah. Tempat belanja keluarga. Family friendly banget. Aneka camilan juga ada. Apalagi aneka penunjang fashion kecantikan ada. Harga terpampang di etalase dengan jelas. Bisa beli buah sesuai kebutuhan saja.",setahun lalu
spy toing,5,"Kalau bintangnya ada 10 saya pilih 10 bintang, karena manna kampus godean memang oye, walaupun dari rumah saya jaraknya cukup jauh, tapi saya senang belanja disitu karena selain lengkap, murah dan yang penting ini pelayanannya kepada pelanggan disemua sektor sangat baik",setahun lalu
Arief Alfarsy,5,"Antrian di kasirnya lumayan lama, maklum ramai pembelinya",setahun lalu
soni warsono,4,"Mintol untuk fasilitas musholanya dikasih tempat terbuka buat pengunjung swalayan jangan buat karyawan saja,mau sholat ashar kata yang jaga sudah tutup...",setahun lalu
Vicello Versen,5,"Salah satu tempat perbelanjaan yg luas , murah & lengkap",setahun lalu
Hid,5,"Udah sering bgt kesini, udah termasuk komplit lah kalo buat belanja bulanan. Dulu belum ada daging/ikan. Sekarang udah ada meskipun ga banyak, tapi udh cukup. Buah dan sayur juga ada. Pakaian juga ada. Kasir banyak, tapi tetep aja antre banyak karena saking ramenya.",setahun lalu
Gabriella,5,"lengkap, harga miring",setahun lalu
Dwi Nugroho,4,Bagus,setahun lalu
Ferani Mulianingsih,5,"Muraahh dan lengkap..
Seneng langganan belanja di sini",setahun lalu
Munji Lestari,5,Tempat belanja yang lengkap dan harga terjangkau tentunya. Parkir sangat luas di belakang. Dan untuk kasir juga banyak sehingga tidak menimbulkan antrian panjang meskipun belanja ditanggal muda.,setahun lalu
nuning refita,1,"BARU KALI INI SAYA KECEWA DENGAN MIROTA GODEAN !! SAYA BELI CHITATO 1 DIITUNG 2 , BUKAN KARNA HARGANYA TAPI TOLONG DITELITI KEMBALII!!!!! TOLONG YAA BAGIAN KASIR MOHON DI KOREKSI !!! SAYA PELANGGAN SETIA MIROTA GODEAN !",setahun lalu
Tivani Tirrta,2,Kasir kurang ramah & kurang sopan  ke pembeli yg berbelanja seolah-olah disepelekan padahal pembeli adalah raja,setahun lalu
Akhila Philia Agape,5,Harga murah dan terjangkau bangettttttttt......,setahun lalu
Rara Mutiara,1,"Makin kesini makin ga worthy karena barang dibanyakin tapi kasir ga ditambah. Antrinya bisa sampe sejam. Mau milih barang ga leluasa karena ketutup org antri, ambil barang gabisa",setahun lalu
Yunisa,5,"Tempat belanja yang lengkap dan terjangkau. Sekarang lebih luas dan sudah ada area butcher nya, frozen food juga banyak, healthy food juga makin lengkap. ",setahun lalu
YAN AJI,5,Tempat belanja kebutuhan yang selalu ramai karena harga murah dan komplit,setahun lalu
Zainal Kamore,1,Kasir yg laki2 lambat banget kerjanya. Aku di kasir dia malah menghilang tanpa ada konfirmasi,setahun lalu
Rusti Oktaviani,1,"Kasir dengan nama fitri nur lama banget, cuman ada 2 antrian dengan belanjaan sedikit tapi lama, terlihat seperti masih magang, padahal kasir sebelah udah sampai 7 antrian dengan belanjaan yg cukup banyak, ada konsumen beli dengan voucher saja terlihat masih bingung, voucher dihitung sampai 5 kali padahal jelas2 cuman 4 lembar voucher, saya sering belanja dimirota sini tapi baru kali ini nemu kasir yg super lama, dan terlihat masih bingung.",setahun lalu
Muhammad Vewagra,5,Tempat belanja bulanan andalan,setahun lalu
Wijayanti Nurul,5,"Sekarang makin lengkapp, mantapp ",setahun lalu
U K,5,Good,setahun lalu
Cindari Ncin,3,"Selamat malam min, tadikan saya belanja di Mirota nah sebelum belanja saya ke ATM yang di tempat parkir Mirota tarik tunai ATM bri nah saya tadi lupa ngambil kartu ATM nya terus saya belanja dan bayar di Mirota dan pulang kerumah nah sampe rumah baru tahu kalo kartu ATM bri ketinggalan . Itu biasanya gimana yah min. Apakah ada yang menemukan ATM dititipkan ke satpam Mirota ?",setahun lalu
Mazz Thonyy,4,Tempat belanja murah,setahun lalu
taurus boy,5,good.....,setahun lalu
Diah puspaa,2,"sebenernya suka belanja disinii, tp gerah bgt lt 2, mana rame bgt antrian, sedih:""",setahun lalu
Meita Wulandari,4,"kalau belanja di lantai 1 murah meriah sekaliiii, nyaman di dompet wkwkwk. tapi menurutku untuk harga baju di lantai 2 cukup mahal yaaa hehe",setahun lalu
riris ismiawati,4,"Maaf sebelumnya, kemarin saya belanja di sini beli barang 2pc dihitungnya 3pc. Mohon ditingkatkan ketelitiannya. Semoga bisa dijadikan evaluasi. Terimakasih",setahun lalu
wassily leontief,2,Ini kenapa toilet cuma 1 yaq.. Knpga mau di tambah gt loo,setahun lalu
Agung nugraha,1,Kasir atas nama Yuli Purwanti tidak ramah sama sekali & wajahnya kurang senyum,setahun lalu
Candy Ra,1,"Kasirnya lamanya gak ngotak, klemar klemer kek putri solo, tolong dong diperbaiki, bikin kapok kesini",setahun lalu
chacha dina,3,Antreannya itu lho,setahun lalu
Rushartono,1,Pelayanan mohon diperbaiki,setahun lalu
Anon Zord,1,Mohon diperbaiki masa pengembalian dana saya lama 14 hari kerja,setahun lalu
Chandra Adjie Sumarna,5,"Pelayanan puas, kasir senyum, bahkan pegawai kantor manna kampus ramah. Mohon agar di manna kampus ditingkatkan jenis2 baju pria/wanita dan celana pria maupun wanita karena masih terbatas variasi dibandingkan manna kampus simanjutak dengan jenis2 pakaian yang lebih bervariasi, mohon agar diperbanyak.",setahun lalu
Ani Novita sari,5,"banyak promo, barang juga lengkap",setahun lalu
Dini Puspita,1,Enggak banget dengan pelayanan kasir an. Salsabila tgl 16jam 12 siang..niat mau ikut undian bukannya didata pakai langsung hanya ditulis aja pakai kertas.. entah deh nanti didata bener apa enggak.,setahun lalu
Widodo Sari,5,"Tempat belanja yang menyenangkan, lengkap, harga murah.
Bisa untuk kulakan untuk dijual di warung lagi.
Untuk hari Jumat, banyak potongan harga. Jadi, sangat berjubel pembeli kalo pas hari Jumat.",setahun lalu
Feby,5,Supermarket yang cukup lengkap. Selalu jadi pilihan buat belanja bulanan. Setiap jumat ada diskon khusus. Antrian kasir dipastikan sangat panjang di tanggal tanggal gajian.,Diedit setahun lalu
Nur Eny,4,Lagi rame2 nya malah kasir selfservice mati dua2 nya,setahun lalu
mamira,1,"Sabtu, 2 maret 2024 jam 12.00

Kasir bagian dkat chatime paling belakang dkt pintu lelet bgt, ngbrol sama tmnnya (bukan soal pekerjaan), bengong gak jlas, antrian dpannya dan samping lainya dah dapet 10, yang ini baru 1 lelet sekali.. nunggu 1 orang 1jam dan lainlainnya 10mnit lebih pdhl saya cuma antri baris ke6 tapi bisa sampai nunggu 2jaman.

Barang udah turuin dikasir gak dang satset di itung. Padhal antrian dah puanjang bgt kok bisa gak ndang satsat ndadak nuggu barang smua diturunin baru di itung.

Tolong di tegur itu kasiarnya dan mbakmbak yang nyamperin kalau antrinya panjang bgt jgan di ajak ngbrol dah lelet tambah asik ngbrol!",Diedit setahun lalu
Muhammad Rifa'i,5,Belanja untuk berbagi,setahun lalu
Nabila Hernandita,2,"sering belanja disini krn murah dan lengkap. tp g bgt deh buat hari ini, nanya stock gula sm anak pkl jawabnya sengak bgt pdhl udh nanya baik2 dan pake nada sopan, kasir jg g ramah, mybe krn rame bgt tp tolong kl cape jgn dilampiaskan ke customer! tdnya mau balik lg belanja krn ada yg kurang jd males!!!",setahun lalu
Ahmad Hadir,3,"Tempat belanja yang komplet, murah, parkir nyaman dan aman, sangat disayangkan fasum semisal toilet sangat terbatas dan terutama mushola yang susah diakses",setahun lalu
Aprilummu FakhriFattanFatirFaqih,4,"belanja disini banyak2 mulai dari anak 1,kalau dulu masih lajang belanja cuma ketengan,enak ada Chatime kalau haus bisa beli didepan,lumayan terdapat banyak promo,kasir sering mengular,tersedia kamar mandi",setahun lalu
Keila,5,"Murah, banyak diskon",setahun lalu
Carla Citra,2,"Sering belanja di mirota tapi untuk hari ini nggak banget pelayanannya .

Dengan sekian banyak antrian yg ada , kasir yang dibuka cuma 1 1 aja dan yang lain dengan tulisan tutup . Jadi antriannya panhang dan lama",setahun lalu
Fidelis Very Ananto,5,Belanja bulanan selalu kesini. Toko tidak pernah sepi selalu ramai. Parkiran kadang penuh. Jadi  harus nebeng parkir di depannya. Harga relatif murah. Belanja disini nyaman. Sayuran juga ada.,setahun lalu
Putu,1,"Antri kasirnya alhamdulillah, 2 jam saja ",setahun lalu
Kung Fang,5,"Sering kesini kl akhir bulan... Antrinya luar biasa,",setahun lalu
barnes chandra,5,"Murah dan lengkap,,..cocok",setahun lalu
Budi Raharjo,4,Swalayan selalu ramai penuh sesak. Tempat nyaman. Harga murah dan lengkap. Pembeli muslim kemungkinan diatas 80% sesuai komposisi penduduk Indonesia. NAMUN KENAPA TIDAK DISEDIAKAN TEMPAT SHALAT UNTUK PELANGGAN?,Diedit setahun lalu
Ary Haryanto,5,Supermarket nan lengkap. Dan pastinya harga jauh lebih murah dibandingkan dengan supermarket lainnya.,Diedit setahun lalu
Yana Terra,5,Bagus,setahun lalu
Febrianto gupari,5,Same stuff lower price only in mirota kampus,setahun lalu
Den Chy,4,"Maaf blm bisa ngasih bintang 5, karena minusnya mushola gak dibuka tiap jam sholat.pas kesana mau sholat ashar sama pedagang diluar ditunjukan mushola dipojok belakang dan ternyata tutup.setelah ditanyakan kembali katanya buka nanti pas magrib.mohon untuk diperbaiki.makasih",setahun lalu
Eko Haryanto,5,"Harga terjangkau, parkir luas",setahun lalu
the aiyun,5,"Cheaper. cashier staffs good and polite.
panmotuburenaiyouniShang niRu retekureru. ",setahun lalu
Inez Salsabila,5,"Dari dulu selalu belanja di mirota godean, barang lengkap, rapi, harga bersahabat dan selalu rame ",setahun lalu
Na V,5,"Suka belanja disini, murah, harga mahasiswa, lumayan lengkap. Awal bulan sama akhir bulan padat sekali, kalau ga mau antre ada kassa self-service bisa scan sendiri belanjaan.",setahun lalu
Afif Himawan,1,"pelayanan antrian kasir terburuk, barang belum ready tapi sudah antri dan bikin stuck dikasir sambil nngguin barangnya dateng",setahun lalu
Apri Yanto,5,"Rekomend,
Parkir luas & gak perlu kawatir",setahun lalu
subagus fredi nugroho,5,Tempat berbelanja murah dan komplit,setahun lalu
Nola Kanestri,5,"selalu rame, tapi tempatnya bersih, pelayanannya juga ramah",setahun lalu
Linda Fatmawati,5,"Seneng banget kalo kesini mau cari apapun disini komplit, tempatnya juga luas, banyak pilihan, bersih dan staffnya  ramah2",setahun lalu
yono irwanto,3,"Lumayan antri an rame banget,seharusnya di kasir di perbedaan ada yg kasir buat troli besar,sama yg pakai keranjang kecil,biar yg belanja sedikit antrean gak kelamaan.",Diedit setahun lalu
Barbie Family,5,"Seneng belanja disini murah2 ..dan ada sayur2 sudah di pack gni.jd buat yg ga jago masak..udah simple bgd diksh contekan nya lngsung..

Emng sih rada susah ksni untuk nyari parkir kalau weekend. Jd ksni nya pas weekday atau weekend gpp tp pas lg hujan..psti sepian",setahun lalu
Nika Woelan,4,"Follow my IG for more beautiful photos or scenery and reviews @NikaWoelan.
Tempat belanja langganan dari lama selain: Superindo dan Hypermart. Sekarang koleksi barang makin lengkap, tapi untuk kualitas pakaian masih enggak banget (modelnya kurang up to date). Harganya selalu paling terjangkau dibanding supermarket lain, tapi tidak ada fresh fish dan meats. Hanya ada fresh veggies and fruits. Sekarang pilihan kosmetik dan skin care banyak dan murah. Staf ramah. Bisa bayar pakai apa aja, termasuk QRIS. Selalu ikut undian tapi gak pernah menang.",Diedit setahun lalu
Anangha Yasmina,5,Muantulll...,setahun lalu
Gilang Kurniawan Kamala,1,Sudah parkir mobil,setahun lalu
Reni Subartiwi,1,"supermarket segede ini ga ada fasilitas sholat, katanya mushola klo kantor tutup ikut tutup, ngantri kasirnya ber jam jam........dl pelanggan setia sekarang kapok kesini lagi",setahun lalu
Kastum Ahmed,3,"Murah, banyak promo, CS nya juga ramah. Sepertinya HRD nya juga perlu di training lagi oleh Customer Service bagaimana cara membalas pesan.",setahun lalu
Cervianda Aditya Aulia,5,Aku suka belanja disini tempat parkir ya lumayan lega buat mobil dan barangnya cukup lengkap,setahun lalu
Mea Phone,5,Deket ku ya Mirota kampus  Jl.ment. Supeno yk. Tmpt belanja terlengkap.dibanding disekitarnya yg semacam itu.  All in ada semua . Sering da promo.  Jumat rabo. Dll . Harga terjangkau. Nyaman pilih pilih lihat lihat. Dan  masuk keranjang. Thx Manna kampus  service memuaskan sipp,setahun lalu
Amanda,5,"deket rumah, seneng bgt belanja disini byk promo & diskon. apalagi pampers nya murah2 disini lebih murah dari baby store",2 tahun lalu
indah novianti,1,Tolong customer service diajari dengan etika sopan santun yg baik&benar.,2 tahun lalu
Regina Cahyanti,5,"Tempat luass, barang lengkap. Kondisi cukup ramai pengunjung, pelayanan baik",2 tahun lalu
Kikin Maya Sari,4,"Tempatnya bersih, luas, bagus, harga juga murah, pelayanan pegawai dalam toko juga bagus, slalu suka belanja disini tiap bulan. Hanya pelayanan satpam di pintu utara agak Rese. Ngelarang2 grab masuk karna rame, padahal kami customer bawa barang banyak, hrus dorong keluar swayalan suruh nemuin grabnya, sampai cancel 3x karna ulah satpamnya.
Saat minta kemudahan, satpamnya malah belagu, diajak ngobrol belaga sok sibuk ga mau nanggepin. Amat sangat disayangkan jika mirota dengan kualitas sebagus ini tercoreng dengan pelayanan 1 satpam yg bisa merusak semua citra Mirota Kampus. Semoga pelayanan diluar swalayan bisa segera diperbaiki. Terimakasih.",Diedit 2 tahun lalu
Finance Beautica,5,"barangnya lengkap, harga terjangkau. parkirnya luassss",2 tahun lalu
Mohammad Haikal,5,Lumayan lengkap,2 tahun lalu
Mas Nur Haryono,5,"Sudah lama langganan belanja disini..
Cuma sayang dari dulu antri bayarnya kadang panjang banget..
Harus tahu jam jam sepinya kalau mau belanja padahal kasirnya udah tambah banyak..
",2 tahun lalu
Stefanus Wahyu,5,"always be favourite place!! saran kalo lagi di jogja download apk 'manna kampus' dulu biar tau promo promo up-to-date nya, emang sesering itu mirota adain promo, indomie pernah cuma seribu kalo hari weekend sabtu-minggu ramee banget di akhir awal bulan kesannya hectic banget but harus siap ngantri juga, tiap bulan ganda juga suka ngadain promo lewat wall speaker dulu pernah dapet minyak goreng cuma 4k, niceyy!!",2 tahun lalu
sannisha,5,"Salut bgt sih mirota tu harganya murah, pelayanan jg oke, cuma parkir kadang gadapet aja, tp so far lengkap dan murah",2 tahun lalu
Andra Junarto,5,kasir self servicenya berguna banget. thanks ,Diedit 2 tahun lalu
MOHAMAD ZUBAEDI,2,"Swalayan yg cukup lengkap, tapi sangat di sayangkan tempat ibadahnya blm ada.",2 tahun lalu
Anisa Prastiari,5,"Lengkap, harga terjangkau, mulai dari fashion, peralatan rumah tangga, fresh product, alat tulis jg ada.. parkir luas ada di belakang dan depan gedung. Kamar mandi bersih, pelayanan ramah.",2 tahun lalu
sa,4,"tempatnya luas, bersih, rapi, lengkap",2 tahun lalu
Isa Bella,5,"tempatnya luas, pegawainya ramah-ramah dan lebih banyak diskon.",2 tahun lalu
Anastasya Sekarani Putri Hernadi,5,"Belanja disini murah2 poll, murah nya jg gk ngotakk
Banyak bnget promo nyaa dan barang nya super duper lengkap bngettt, kasir nya ramah2 poll, tp minus nya ramee biangett eee..
Apalagi pas awal bulan & hari jum'at-minggu, jngan mengharapkan kasir kosong pada saat itu dan buat bergerak jg susah poll",2 tahun lalu
Feby Zhang,5,"Kalo mau belanja bulanan murah, disini tempatnya, cuma harus sabar dengan antrian yg rame dan panjang ",2 tahun lalu
Heni Setianingsih,5,"Tempat belanja terpercaya,dari jaman SMP...suka kalap kalo sudah masuk kesini,cemplang cemplung tanpa lihat harga karena murah...sudah jadi membernya tapi belum pernah dapat hadiah undiannya...semangat Manna Kampus GBU....",2 tahun lalu
Faradina Nur Mahdiani,5,Baguss komplit cm klau tgl muda dan weekend antrian dikasir paanjaaaaaaangggg buaaangeetttt...,2 tahun lalu
Hana Adikti,5,"lengkap, pelayanan ramah, harga murah",Diedit 2 tahun lalu
Mira Astanti,5,"Tempat belanja berbagai kebutuhan, dari sembako, makanan, perlengkapan rumah tangga, ATK, fashion, dll. Harga mayoritas item lebih murah.
Tempat luas, jarak antar rack lega, gak sempit. Parkir luas, kalo hari weekend apalagi tanggal2 muda penuuhh yg belanja ...",2 tahun lalu
Novandy Essa,3,"Satu foto pada bagian kasir sebelah selatan sudah bisa menjelaskan keadaan toko pd tanggal 3 November 2023. Ramenya luar biasa. Biasanya di awal bulan mulai tanggal 1-5 an antrian akan ""nggilani"". Mirota sudah terkenal murah dikalangan penduduk Jogja dan mahasiswa makanya rame banget. Orang2 yang punya toko juga saya lihat biasa kulakan ke sini. Sebenernya udah ga kaget sih, tp alangkah baiknya manajemen memperbaiki sistem pembayaran untuk tanggal rame2nya. Masukan dr saya untuk manajemen, sekiranya tiap awal bulan, bagian kasir ditambahkan helper (hanya casual/kerja harian) yang job desknya packing.. Jadi kerja kasir tidak berat, bisa fokus dan cepat, karena ada yg membantu packing. Bayangkan aja belanjaan sekeranjang merah untuk di handle kasir sekaligus packing bisa memakan 10-15 menit minimal. Kalikan dg antrian 20 -25 org mengular ke belakang. Selain tidak efisien, juga akan banyak keranjang berserakan karena orang tidak jadi belanja. Yah... Semoga ke depannya Mirota Kampus lebih baik lagi untuk membenahi bagian ""lama antri"" yang saya rasa sudah jadi masalah sejak dulu.",2 tahun lalu
Murv Kirani,5,Tempat belanja ,2 tahun lalu
VoeR VoeR,4,"pertama kesini, itu jg karena ada parkir yg kosong (biasanya gak pernah kebagian)...
bagus, karena makanan non halal ada keterangannya (walaupun masih campur rak dgn yg halal)...
mau buat member tapi katanya kartunya lg kosong & gak tau kapan ada lg....",2 tahun lalu
Setiyaningsih,5,Komplit,2 tahun lalu
Agung Raharjo,5,"Semua kebutuhan sehari hari ada disini, dari bahan pokok sampai pakaian pun ada",2 tahun lalu
Peni Rahmawati,5,"Kalau tanggal muda antrinya luar biasa. Banyak promo, barang lengkap",2 tahun lalu
Monika Titisari Nurjaya,1,"TUKANG PARKIR BAD BANGET!! SAKPOLLEE
Harga murah tapi, tukang parkir bad, bikin rusak mood dan males buat kesini lagi.",2 tahun lalu
Melisa Ratnasari,5,"Lengkappp tapi kurang nyaman sama keberadaan spg produk yg ngalingin customer milih2 dan harus ngalah, kryawan mirota sendiri udah bejibun banyak ini tambah spg2 duhh kdg bikin kurang leluasa aja senggol2an",2 tahun lalu
resa pramudita,1,"Kecewa. Sudah sering belanja kesini. Tp memang baru hari ini coba beli kosmetik disini ,jadi gatau sistemnya gimana, pramuniaganya stay ditempat tp responnya lama, jawaban nya cuek pollllll, kalo barang ga ada jawabnya  ""adanya cuma yg disitu"" padahal saya juga beli , ga minta mbak. Saya juga kerja di pelayanan jasa. Kalau rame mah saya wajar namanya kerja juga capek. Tapi tadi di stand kosmetik cuma ada saya ga ada pelanggan yg lain. Lain kali mungkin bisa diperbaiki lagi pelayanan nya .",2 tahun lalu
Pipi Cabi,5,"Komplit murah
Cuma harus sabar antri kasirnya karna ya memang sangat ramai",2 tahun lalu
WHIeN,5,"Mirota ni gak pernah sepi...komplit, murah, apa aja ada. Manteb.
Ada Chatime juga disini

Gak heran setiap tgl muda antrian kasirnya luar biasa 

Parkirannya lumayan luas, sayang gak ada ATM B*A disini",2 tahun lalu
garin hadid,5,Tempat wajib tiap bulan,2 tahun lalu
Adelina Indah,5,"Favorit juga nih tempat belanja  mantap juga koleksinya banyak mulai dari makanan,minuman, kebutuhan rumah tangga lengkap parkiran juga luas pol",2 tahun lalu
Xwzvq,4,"Sering kesini buat belanja bulanan, banyak buah dan sayur segar, harga relatif murah",2 tahun lalu
Syeh Dakon,5,"Tempat belanja yang sudah legend sejak dulu berdiri kokoh, tempat belanja berbagai kebutuhan, dengan letak dipinggir jalan yang sangat strategis, sering banyak discount dan promo, sangat ramai sekali dan tempat yang cukup luas dan parkir yang sangat memadai, solusi belanja cepat dengan pelayanan yang cukup baik dan cekatan, pingin beli camilan, kue2 kering, belanja kosmetik, sekedar beli kopi saset, atau sabun, odol, sabun cuci, tinggal pilih aja, mau ajak jalan pacar sambil belanja cocok juga, mau belanja kebutuhan sehari disini tempatnya sangat komplit dengan agar miring jg, malam2 pingin beli mie tinggal pilih dengan berbagai aneka rasa, mau beli minuman komplit juga, mau beli kebutuhan sekolah tinggal ambil bayar dikasir, mau nyopet mending jangan ini bulan tempatnya, ini tempatnya orang belanja dengan segala kebutuhan dan kemudahan",2 tahun lalu
tiyopras,5,oke,2 tahun lalu
fikri nur huda,5,bersih. belanja murah & langganan,2 tahun lalu
Riko Adi Cahyono 11,2,"ketidak sesuaian promo yang di berikan, tertera pada produk tapi setelah di beli kasir sama karyawan banyak yang tidak tahu dengan promo yang di berikan dan haru mencari tahu sendiri",2 tahun lalu
Handoko Tasiban,5,Lumayam lengkap untuk kebitihan anak kos,2 tahun lalu
indra waspada,5,Tlg dikasih mushila di luar jam kantor dah tutup musholanya,2 tahun lalu
yumin kwan,5,"Tempat belanja murah, lengkap, dan nyaman",2 tahun lalu
ester aries,4,Cukup komplit pakiran cukup luas,2 tahun lalu
xworkshop jogja,5,tempat andalan buat belanja murah..,2 tahun lalu
Tika Yulia,4,Harga murah sering banget promo. Cuman tolong untuk kasir lebih teliti yaaaaaaaa.,2 tahun lalu
Rajo Alamando,5,Tempat belanja yang selalu ramai,2 tahun lalu
nindya puspitta,2,"Pelayanan bagian kasir lama sekali, pegawai nya maaf kurang cekatan, sekali antri bisa 45menit, pdhl konsumen nya yg antri belanja tidak banyak. Terima kasih..",2 tahun lalu
wied anto,4,Tuk kebutuhan RT,2 tahun lalu
RatihS,5,"sebagai pendatang saya awalnya keliling pilih swalayan yang paling oke menurut saya untuk kedepannya langganan. dan saya pilih mirota kampus ini. tempatnya selalu rame. saya suka nya untuk harga kadang ada promo beberapa item, kemudian variasinya komplit. minusnya paling di bahan segar ya, kalo bahan segar saya tetap lari ke super*ndo. ini untuk harian kayak sabun, jajan, tissue, dkk",2 tahun lalu
