nama_penulis,rating,teks_ulasan,waktu
Melisa Banggo,4,"Barang"" nya sangat lengkap dengan harga yang sesuai dengan kantong mahasiswa. Tempatnya meskipun sangat ramai tetapi tetap nyaman.. recomended",3 tahun lalu
kania Dwi,4,"belanja bulanan selalu disini, tempat yg luas barang2 komplit dan selalu ada tapi sayang bgt kadang ada mba2 karyawan yg kalo ditanya judes bgt dan ga ngenakin, tolong lebih ramah lagi",3 tahun lalu
Husnul Fajri,4,lumayan lengkap,3 tahun lalu
Herman Pamungkas,5,"Daripada mall besar yg lain, disini lebih lengkap dan murah meski tempatnya kecil. Bisa cashless payments juga. Mantabs!",3 tahun lalu
Rief Arifin,4,Good places for daily goods,3 tahun lalu
Sabil,5,So crowded,3 tahun lalu
Andika Setiyawan,5,"Murah, lengkap, dingin pulak..hehehee. cuman ya itu mau bayar aja antriannya panjang bener apalagi habis gajian",3 tahun lalu
Praf Cho,5,"Harga miring, perlengkapan kebutuhan rumah tangga lengkap.",3 tahun lalu
khoir umi Laksana,5,Swalayan lengkap dan murah di Yogyakarta. Selalu ramai dan antri wkwk. Kaynya setiap awal bulan mereka bakal kesini deh hmm,3 tahun lalu
Tbilisi Avenue,5,Good bakery near house,3 tahun lalu
Ardi Firmansyah,5,"Rekomendasi tempat berbelanja daerah barat jogja, murah dan banyak pilihannya. Kalo datang langsung menuju bagian tengah biar tau yang sedang promosi, pilihannya beragam sampai pecah belah pun ada. Kalau gabut disini sudah ada chatime juga buat nyegerin haus.
Kumpulin tiket undian biar dapet hadiah utama ya gaes.",Diedit 3 tahun lalu
Anna Cianah,5,"Tempat nya nyaman, pelayanan cepat dn harganya sesuai",3 tahun lalu
Bay,5,Lengkap semua kebutuhan sehari-hari cuma agak ramai jadi lumayan antri lama,4 tahun lalu
Eko Susanto,5,"Minimarket yang khas dengan berbagai sajian kue, sangat tepat untuk anda yang akan mencari bingkisan untuk saudara, teman dan handai taulan",4 tahun lalu
Hanif Nusena,5,"Murah, nyaman",Diedit 4 tahun lalu
Arfian Cahya,5,"Mirota Godean tempatnya lebih luas dari pada Mirota kampus yang Deket SV UGM jadi lebih enak buat belanjanya wkwk. Lahan parkir nya juga terbilang luas, barang lumayanlah lengkap, cuma jalan Godean sering banget macet apalagi pas jam 11-12. Tempatnya bersih dan nyaman, pelayanannya juga okey.",4 tahun lalu
Pascal,5,Belanja hemat ya di indomaret ajaaa eh salah di mirota kampus godean lah yaw cusss,Diedit 4 tahun lalu
Phaza HaKa,4,"tempatnya luas, banyak pilihan dan selalu belanja untuk kebutuhan bulanan disini serta tempat parkir luas",Diedit 4 tahun lalu
Lutfy,5,Sejak tinggal di jogja selalu belanja bulanan kesini.. komplit dan harga terjangkau,Diedit 4 tahun lalu
Mario Esguerra,5,Cocok banget buat anak kost,4 tahun lalu
danik lestari,5,"Tempat belanja murah d jogja, parkir luas...",4 tahun lalu
Yeni Setiawan,5,"Tempatnya luas, parkir mudah, harga barang murah meriah.",4 tahun lalu
marhaendra putri,1,"ebuset.. yg antri panjang banget tp yg didepan belinya kulakan, beli berkadurdus eceran susu kental manis dll.. gak ngertilah apa.. Penasaran brp lama kasir layaninnya ternyata lebih dari setengah jam.. Ditambah AC nya enggak nyala atau di kecil.. Sumuk pooolll",4 tahun lalu
Bhe2 Be,5,Mantab...,4 tahun lalu
wildan amanullah,5,"tempat yang cocok buat berbelanja,dan bermacam-macam makanan yang enak dan unik tentunya",4 tahun lalu
Jonathan Adriel,4,Tempat yang sangat luas dan lengkap. Bannyak pilihan barangya dan sangat luas. Tempat parkis juga besar. Hanya saja kadang sangat ramai dan untuk mengantri memakan waktu yang lama.,4 tahun lalu
Faisal Zaki,5,Tempat belanja yang selalu ramai.. Hindari belanja saat tanggal muda dan akhir bulan karena sangat ramai terlebih pada antrean kasir... Untuk harga murah dan banyak bonusnya..,Diedit 4 tahun lalu
Wiwin Nur Cahyanti,4,"Mulai dari cemilan, fashion, barang keperluan rumah tangga, barang elektronik, stationary, semuanya ada, buat harga udah paling murah dibanding tempat lain. Deket bgt dari tempat kerja, jadi sering keluar masuk Mirota sekedar buat jajan ",4 tahun lalu
didik nur prasetyo,4,too crowded,4 tahun lalu
Silalahi Ongki,2,"Mohon security ditraining  lagi, supaya lebih sopan dalam menegur pengunjung.

kejadian minggu lalu, ada keluarga dengan anak bayi kecil tidak bermasker, security pintu depan menegur seperti mengusir tidak sopan menurutku. mohon ditegur supaya lebih humanis, apalagi itu bayi yg memang akan susah nafas jika harus bermasker, bisa disampaikan dengan sopan.

Semoga dibenahi.
terimakasih",4 tahun lalu
Anindita Ayu Gita Coelestia,5,Mirota Kampus Godean salah satu cabang mirota kampus yang lokasinya mudak diakses dan tempatnya cukup luas sehingga berbelanja menjadi lebih nyaman. Parkirannya pun luas.,Diedit 4 tahun lalu
Albertus Aditya Budi Setiawan,4,"Tempat belanja serba ada dan lengkap...

Semua kebutuhan rumah tangga ada di tempat ini:
Sayur-mayur
Daging
Roti
Peralatan dan kebutuhan rumah tangga
Fashion
Alat tulis dan kantor
Peralatan listrik
Kebutuhan bayi
Kosmetik
Obat-obatan

LENGKAP

Harga relatif murah...

Saat ini tersedia layanan pesan dan antar...",Diedit 4 tahun lalu
Was Roni,5,Murah,4 tahun lalu
Annisa Ulfah,5,"Lengkapp, serba ada sih, sering ada promo juga, apalagi pas hari jumat, andalan anak kos bngt ini murah.. serba ada",4 tahun lalu
Bang Hariku,5,Tmpatnbelanaja luas bersih,4 tahun lalu
imei andriani,4,"Barangnya lumayan lengkap.
Selalu ramai pengunjung. Tiap kesini lorong paling padat menurutku lorong mie instan dan persabun mandian.
Kasirnya udah banyak, tapi seringnya tetep antre panjang apalagi kalau belanja sore.
Kasirnya juga tegas untuk tetap jaga jarak dalam mengantri, serta tidak menyerobot antrian.",4 tahun lalu
Abid98 MotoVlog,1,"Pelayanan lama, ada jalur prioritas jadi kalo ada karyawan sana yg sedang belanja didahulukan dari pada castemer yg sedang antri.",4 tahun lalu
Siti Rohana,4,"mirota smua sama aja ya , pegawainya yg tdk.menggunakan seragam mirota suka nya ngerumpi bukan KERJA, Menurutku sih menganggu konsumen belanja ya apa lagi ngbrolnya smbil nongkrong di t4 orang jalan .",4 tahun lalu
Sar Yono,3,Hari2 menyenangkan,4 tahun lalu
Alex dekweldju,5,"Cheap and complete supermarket
Kalau kita datang saat baru buka sekitar jam 10am, biasanya kita diberi hadiah,piring, tas reuseable, dll",Diedit 4 tahun lalu
WJ Tresna,5,Tempat belanja grosir di jogja,Diedit 4 tahun lalu
Rizky Amira,5,"Bagus, salah satu supermarket yang paling lengkap dan murah di jogja, mungkin agak susah nyari produk-produk luar yang jarang ada, tapi kalau produk lokal lengkap lah, murah yang pastinya, tapi rameee bangettt",4 tahun lalu
Nurdina Dwi Yahya,4,Pelayan ramah. Cekatan. Harga bersahabat,4 tahun lalu
Mulyo Sugito,5,Pelayanan memuaskan dan harga lebih murah.,4 tahun lalu
safar hudi,5,Pelayanan ramah,4 tahun lalu
Ita Rahmawati Al Maran,5,"barang lengkap, parkir luas,harga murah, pelayanan ramah, banyak promo, tanggal tua/muda tetap ramai",Diedit 4 tahun lalu
Peeineentok 11,5,Good,4 tahun lalu
Yuni Listianingsih,4,Kasir lambaaattt...,Diedit 4 tahun lalu
Rizki Dika Kurnia Sari,4,"Jarang sih belanja bulanan kesini karna awal bulan mesti rame pol, kalo bawa anak kecil kasian",4 tahun lalu
yuk berbisnis,5,Lengap semua kebutuhan,4 tahun lalu
Afit Amin Rauuf,5,"Yang belum tau bisa cek lah, kebutuhan seahari hari yang klean cari ada, sandang, pangan, prabot ,dll",4 tahun lalu
ifan marwa (Marwan),5,Komplit murah lengakap,4 tahun lalu
Arum Puspita Sari (Arum),5,"Bagi masyarakat Jogja, mirota adalah tempat belanja yang cukup familiar. Mirota ini menyediakan berbagai macam keperluan sehari hari. Mulai dari bahan makanan, perlenglapan sehari hari dan rumah tangga, pakaian, sepatu, sendal, buah bahan, sayur mayur, makanan hewan peliharaan, make up, alat tulis, alat masak, mainan, dan masih banyak lagi.

Saya sering sekali belanja di Mirota khususnya yang di Godean ini karena barang-barangnya lumayan lengkap, parkirnya sangat luas, walaupun ramai tapi petugas kasirnya ada banyak, harganyapun juga termasuk murah dan banyak promo.

Untuk susunan display barang barang di toko Mirota Godean ini juga cukup rapi. Sudah ada keterangan di tiap rak yang menunjukkan barang apa saja yang ada di rak tersebut. Tentu ini akan sangat mambantu pengunjung.

Kemudian disaat pandemi seperti saat ini, di Mirota juga sudah disediakan tempat cuci tangan dan pengecekan suhu badan. Sudah dijaga oleh security juga. Saya juga sering dengar melalui speaker toko, peringatan untuk tetap jaga jarak dan mematuhi protokol kesehatan.",4 tahun lalu
Marisa Nurhayati,5,"Tempat belanja langganan terlengkap, tempatnya luas, banyak diskonnya. Pelayaman ramah dan kualitas barang oke.",4 tahun lalu
Citra Souvenir Jogja,5,Komplit,4 tahun lalu
deena Cloridina,5,"Lengkap
Murah
Nyaman",4 tahun lalu
Aloysia Gaia'Ku (Yani),4,Luas n lengkap,4 tahun lalu
Ayah Arini,3,"Nilai positif : Lokasi strategis, parkir luas, sbelum masuk toko mesti cuci tangan + cek suhu, pilihan barang lumayan lengkap & beragam,
Nilai minus : jarak antar rak barang terlalu dekat susah untuk menjaga prokes didalam toko, antrian kasir cukup panjang (belanja hari minggu jam 15.45-17.00)",4 tahun lalu
sigit tri hastomo,4,"Tempatnya nyaman, komplit, pelayanan bagus",4 tahun lalu
fitri alfiana,4,"Toko yang lengkap di jogja, kebutuhan sehari - hari seperti makanan, bahan-bahan dan peralatan dapur, peralatan rumah tangga, ATK, Pakaian, Aksesoris, sembako, kosmetik, peralatan pribadi, buah-buahan, kue, minuman. Biasanya ada diskon. Parkirnya aman, jumlah kasir cukup banyak. Setiap harinya selalu rame pengunjung, tapi tetap dihimbau untuk menaati protokol kesehatan. Untuk pengemasan barang yang dibeli cukup baik karena menawarkan kardus dan kresek. Tempat yang cocok buat kamu yang pengen belanja bulanan nih hehe. Ada musholla juga",4 tahun lalu
Bangkit Ha Pe,4,"Tempatnya luas, lengkap dan nyaman, layanan cepat,  satpam ramah, tempat parkir luas,  kebersihan terjaga, sirkulasi udara baik, disediakan toilet umum, tempat cuci tangan, termogun,
Penerangan dalam tiki cukup baik,

Sayang Fasilitas mushola yang disediakan kebersihan kurang terjaga.
Semoga  dapat menjadi masukan positif untuk pelayanan Mirota.",4 tahun lalu
rnt rinanto,5,Tempat belanja terpercaya dan termurah utk kebuthan sehari2 dan sering ad undian berhadiah. Cmn tdk sprti dlu utk kantong plstiky tdk dipisah misal belanja sabun dan roti,4 tahun lalu
Maninta Natya Fury,5,"Tempat lebih luas dibanding mirota simanjuntak, murahh, dan banyak promo pastinya",Diedit 4 tahun lalu
veronica cg,5,"Dari semua mirota kampus yang ada di Jogja, mirota kampus godean ini adalah mirota terluas dan ternyaman untuk berbelanja karena penataannya bagus

Semua staff mirota sudah ditraining untuk ramah dan profesional sepertinya, beda dengan supermarket lokal lainnya

Harganya pun bersaing, warga Jogja lebih suka belanja di swalayan lokal daripada indomaret alfamart soalnya swalayan lokalnya murah meriah

Antrian kasirnya kadang-kadang cukup panjang, terutama hari Jumat karena ada program diskon di Mirota tiap Jumat

Tiap tahun ada undian rumah/mobil, kupon belanja, dll dengan cara berbelanja dengan nominal tertentu akan mendapat 1 kupon, berlaku kelipatan. Tapi saya belum pernah menang 

Jangan lupa kalo ke Mirota beli Pukis Bikang Asli di depannya, pukisnya lain daripada yang lain, lembut banget",Diedit 4 tahun lalu
Ripning,5,Lengkap  harga terjangkau....parkir luas..pokok nya selalu langganan belanja di mirota..,4 tahun lalu
Dhani Wijanuari,5,"Terletak di tempat yang strategis, di jl godean,
Semua perlengkapan rumah tangga, mainan, baju, semuanya tersedia.
Harga murah dan pelayananya ramah",4 tahun lalu
Mas Joko,5,Great store and competitive compare to branded store,4 tahun lalu
Martini19,4,murah lengkap parkir luas,Diedit 4 tahun lalu
Sugeng Waluyo,4,Bag us temptnya n murah tp saying kalo belanja pas tgl muda kelamaan antri dikasirmya,4 tahun lalu
Erni,5,"Produk lumayan murah, rapi, pelayanan ramah",4 tahun lalu
Dewi Sutjipratiwi,5,Tempat belanja murah n nyaman,4 tahun lalu
Widhiuw,5,"Salah satu tempat belanja paling lengkap dan terpadat di Godean, Yogyakarta. Ada dua pintu masuk + 2 tempat parkir. Meskipun mungkin nggak seluas dan selengkap Mirota Jalan C. Simanjuntak, tapi overall sudah lumayan.",Diedit 4 tahun lalu
Dinur Iksan,5,Nyaman buat belanja sama keluarga,Diedit 4 tahun lalu
Elvandro Rahaditya,4,"Kalo gak corona, bintang 5. Pas corona gini ukuran gang senggol dengan pelanggan seabrek, kurang recommend kecuali cari jam2 sepi.",4 tahun lalu
Hartono Budi,5,"Belanja disini lumayan nyaman, tidak begitu capek, jarak gerai item satu dengan yang lain berdekatan.

Tersedia banyak barang pilihan, harga terjangkau, Kasir banyak,pelayanan cepat dan mengerahkan PROKES ketat.",4 tahun lalu
042_ Putri Annisa,5,"Menjelang lebaran, pengunjung sangat banyak sekali",4 tahun lalu
Ratno Wibowo,3,"Barang lengkap parkir luas, ya cukup nyaman untuk belanja, pas hari2 tertentu bisa rame antrinya",4 tahun lalu
Betty Mx,5,Suka belanja disini...tersystem...murah ..lengkap...mantap,4 tahun lalu
Nina Sari,4,"Tempat belanja kesayangan di kota jogja karena dekat dengan rumah,  dan ada kue pukis yummy di lobby belakang.",4 tahun lalu
Nugraha 99,1,"Tukang parkir motornya gak mau kerja ,cust disuruh parkirin sendiri ,sok sokan gak jelas",4 tahun lalu
Anisa Nur Habibah,3,"kemaren habis kesini bawa anak yang usianya belum ada setahun, dan ternyata bayi kalo mau masuk sini harus pake masker, setau saya kalo bayi usia dibawah 2 tahun ga boleh pake masker eh disini diharuskan bayi pake masker :"")",Diedit 4 tahun lalu
Nur B,4,"Lengkap komplet dan tak terlalu ramai,
Dateng jam 11an si",4 tahun lalu
Muazzam Abid,5,"Lumayan komplit untuk belanja bulanan
Walaupun tak selengkap di mirota kampus ugm",4 tahun lalu
Bekti,4,Super market nya cukup lengkap dan harganya pun cukup miring.. akan lebih sempurna jika cashir nya lebih gercep,4 tahun lalu
Rizky anggraini,5,Kalau tanggal muda dan tanggal tua selalu crowded bgt tapi gak pernah kapok krna komplit barangnya,4 tahun lalu
Krisna Hari,4,"Parkir luas,  banyak pilihan dan  harga murah",4 tahun lalu
Mo,5,"banyak promonya, lengkap, lebih murah dibanding bbrp supermarket. tp kalau pas busy hours crowded bgt, ngantrinya panjang ",4 tahun lalu
Kartika Dewi Anggraini,1,Jika ingin pembayaran cashless (gopay) tidak disarankan pada sore hari terutama menjelang maghrib karna mesin edc'nya slalu trouble. Karna saya sudah mengalaminya 2 kali,Diedit 4 tahun lalu
sigit wibowo,5,"Supermarket lengkap dengan harga terjangkau, tempatnya bersih dan rapi, pelayanan ramah",4 tahun lalu
Abdul,1,"Sekarang anak kecil di bawah 5 tahun TDK boleh masuk,,,
Jadi males mau belanja kesini",4 tahun lalu
someone special,1,"Customer service malah ""ngrasani"" ketika ada pembeli complin & Petugas parkir blkg yg cewek mlh ngetawain ketika ada yg kena palang saat berjalan kaki..Semrawut pintu masuk & keluarnya ada 2..tidak jelas mana yg pintu masuk & mana yg pintu keluar..",4 tahun lalu
rendra Kuntadi,5,Tempat belanja istri ,4 tahun lalu
leny dwi lestari,4,"mirota adalah tempat belanja kesayangan warga dan mahasiswa jogja. siapapun yang pernah tinggal di jogja pasti tahu mirota. segala kebutuhan dapat ditemukan di mirota, pakaian, kosmetik, alat rumah tangga, makanan, alat tulis kantor dan banyak item lainnya.",4 tahun lalu
Kakang ian Anom,5,Lengkap. Harga murah. Kalau belanja banyak mending bawa bag sendiri. Tapi toko juga melayani packing pakai dus.,4 tahun lalu
Fonni Mer,5,"Kalo yang satu ini, udah ga diragukan lagi lah ya. Buat memenuhi kebutuhan rumah, cemilan dan perabotan yang murah dan pas dikantong ya disini tempatnya...",4 tahun lalu
Fitriani Rumbaru,5,Surganya eike belanja! Fix!,4 tahun lalu
nanang putut budiantoro,5,Mantap,4 tahun lalu
Annisa Nurul Ulfa,5,"Tempatnya besar, parkirnya luas, barang lengkap  ",4 tahun lalu
Mas landak Ardi,2,Blum pernah masuk,4 tahun lalu
Yudhistira Erdwin Pradana,5,Tempat belanja termurah,4 tahun lalu
Yang Hastin Tiya Fitriana,5,"Sering banget belanja kesini ,banyak promonya apalagi khusus hari Jumat",4 tahun lalu
anang atmojo,5,Mirota paling asik,4 tahun lalu
Rusdi Yanto,5,Tetap memuaskan pelayanannya,4 tahun lalu
Yopi Jalu Paksi,5,Pusat perbelanjaan murah di Jogja. Tempat luas. Parkir luas. Kasir banyak. Disediakan tempat cuci tangan. Sayangnya toilet luar cuma satu. Overall bagus.,4 tahun lalu
Muhammad Iqbal Rizqi,5,Tempat nyaman untuk berbelanja kebutuhan harian rumah tangga. Harga sangat bersahabat. Terimakasih Mirota!,4 tahun lalu
Benjo Hard core,4,Baik,4 tahun lalu
nita dyah Suseno,5,Hemat belanja dsni,4 tahun lalu
bezita 13,5,komplit dan harga lumayan bersahabat,4 tahun lalu
Agni Aska Arifiah,5,Cocok utk belanja bulanan,4 tahun lalu
Monica Ardanari (Niq),5,"  ,     .    ,   .     ,   ,     ,,    , 2.
 2       ",4 tahun lalu
Arin Iswanti,4,"Tempat belanja bulanan langganan , harga nya murah murah ,  tempat nya rame banget gaes , deket dari rumah , parkir juga murah 1000 rupiah ,tempat parkir luas",4 tahun lalu
Irene Meitiniarti,5,"Lengkap, banyak pilihan, dan harga bersaing",4 tahun lalu
kurniawan ahmad,5,Mantap sekali,4 tahun lalu
Theresia thekla moniaga,1,Keren.,Diedit 4 tahun lalu
irfana surya,4,Tempatnya belanja harga promo wkwk,4 tahun lalu
Rahma Putra,5,Tempat belanja murah,4 tahun lalu
Faiza Zeni Nuryani,5,"Murah, nyamann",4 tahun lalu
Sianiwati Caca,5,"Tempat belanja yang nyaman. Hanya jangan keseringan ganti layout. Sudah hafal tempatnya...eh dipindah lagi, bikin pusing. Perbanyak brand premium ya..",4 tahun lalu
Maria Goretti,5,Menyambut puasa dan idul fitri  barang barangnya sudah komplit.. biscuit permen  syrup dan lain lain,4 tahun lalu
Montana 97,5,Boleh lah,4 tahun lalu
Joko Purwanto,5,Mirota jl godean parker luas yg memenuhi kebutuhan rumah tangga,4 tahun lalu
Ahmad Nuryansyah,5,Terbaik,Diedit 4 tahun lalu
Sidik Prananto,5,"Komplit, pelayanan cepat Joss pokoknya",4 tahun lalu
indra satria,5,"Murah, lengkap, nyaman, ",4 tahun lalu
Lalu S Wijaya Akbar,5,ga ada yg ga kenal sama swalayan yg satu ini...,4 tahun lalu
zai tanjung,5,Oke,4 tahun lalu
Muamal Zedda,4,"Seperti Tempat Belanja pada Umumnya.
Cukup lengkap memenuhi aneka kebutuhan belanja Rumah Tangga",4 tahun lalu
Andi Yuwono,5,Lengkap & murah,4 tahun lalu
Aron Sidabutar,5,"paling suka belanja di sini karena lebih murah
kekurangannya: buah2annya termasuk mahal dan pilihannya sedikit
selebihnya mantap",4 tahun lalu
Ari Wardhana,5,"murah, tempat nya nyaman, walau antri tetapi tidak lama, Kasir sangat cepat dan cekatan, walau rumah saya jauh saya akan kembali lagi ke Mirota Godean",4 tahun lalu
apri hariyanto,5,Tiap bulan kesini. Cocok buat blanja bulanan,4 tahun lalu
Faidana Yaumil Syifa,5,Tempat dan lahan parkirnya luas dibanding mirota yg lain.,4 tahun lalu
Anisa Dwi Susanti,5,Ntap,4 tahun lalu
Seagate thanmust,5,"Tempat Belanja paling menyenangkan. Parkiran luas, lengkap, nyaman dan yang paling utama adalah murah!",4 tahun lalu
Nia Astuti,5,Bagus,4 tahun lalu
Atiika anastasia,3,Tempatnya luas,Diedit 4 tahun lalu
riyan adi putra,5,Good... Tempat belanja luas dan menyenangkan,4 tahun lalu
Sri Handayani,5,Tempat belanja keluarga yang nyaman dan murah,4 tahun lalu
Bella Tiara Putri,5,"Selalu ramai dikunjungi pelanggan, selain itu harga relatif lebih murah ",4 tahun lalu
Arif Firmansyah,5,"Produk lengmap untuk kebutuhan sehari2. Harga sesuai untuk semua kalangan. Jangan kesini sore hari, jalan godean macet.",4 tahun lalu
nekasius rahardian,5,Asik,4 tahun lalu
azizah yn,5,Lengkap,4 tahun lalu
Eka Noviana,5,Murah dan lengkap.,4 tahun lalu
Fidina Nur Hanifa,5,"Supermarket yang
Sekarang  bertambah luas, lengkap barang2 yang dicari, lebih mudah ditemukan apa yang dicari karena diberi papan diatas rak, jarak antara rak 1 dgn yg lain tidak terlalu jauh, jadi mudah mencari kebutuhan2 namun saat ramai menjadi terasa sempit..",4 tahun lalu
Nana Rina,4,Cukup lengkap,4 tahun lalu
Sigitpc Sulartono,3,Ribet parkir mobolnya,4 tahun lalu
Nowan Winarko,4,Selalu rame,4 tahun lalu
Dhany Dhaniel,5,Ok,4 tahun lalu
calista berliawanda Adianata Estupa Andarini,5,Sangat memuaskan...,4 tahun lalu
Bunito Wito,5,Tepat lganan belaja bulanan,Diedit 4 tahun lalu
Ronny Oktovianto,5,Ok,4 tahun lalu
Puguh Asnawi,4,Traffic nya luar biasa,4 tahun lalu
AGHA,5,The best among all Mirota,4 tahun lalu
Lasmi Azizah,5,Barang Komplit. Murah. Karyawan ramah,4 tahun lalu
Bahru,5,Kampus yang tidak pernah demo,4 tahun lalu
Alexander Nio,5,"Supermarket dengan berbagai macam kebutuhan pokok, fashion, dan alat"" serba guna, dengan pelayanan yang sangat baik, juga memuaskan",4 tahun lalu
dina,5,"semua ada disini. mending kalo belanja jangan pas akhir bulan/awal bulan, rame banget :"")",4 tahun lalu
Rois Amaluddin,5,"Barang yang tersedia di toko komplit,pelayan toko sigap dan siyap dalam menanggapi konsumen, untuk kasir HEBAT betul,cepat tangkas dan teliti...cantik cantik lagi... Uhhh mantap, sangat recommended balanja disini",4 tahun lalu
Agung Pradjoko,4,"Lengkap, parkir belakang sdh elektronik jd lbh safty, buat mami2 yg butuh minyak goreng banyak tdk ad batasan pembelian aplg dg syarat2 ttu spt pesaing market lain, kita bayar knp hrs dibatasi/nunggu2 promo?",4 tahun lalu
Syamsu Nur,3,Lengkaapp dan cocok dg kebutuhan rumah,4 tahun lalu
Ppu Pyu,5,"supermarket yang lumayan lengkap dengan harga terjangkau,
di sini menjual beberapa kebutuhan sehari-hari, ada baju juga, ada barang pecah belah.
parkir termasuk luas (parkir ada di depan dan belakang).
selama pandemi, disediakan tempat cuci tangan dan diukur suhu tubuh sebelum masuk. Area wajib menggunakan masker. Sebaiknya tidak membawa anak balita ke dalam.

Karena tempat ini cukup lengkap dan murah, sebaiknya menghindari untuk berkunjung di awal bulan / akhir bulan (waktu-waktu setelah gajian). Karena akan penuh sesak dan antrian di kasir membludak",4 tahun lalu
Coach Ali Shah,5,"Easy accessed. Tepi Jalan Godean dalem ringroad, parkir depan ada, belakang lebih luas, mending parkir belakang sih. Mau load barang ke mobil lebih santai. Apalagi bawa anak kecil.

Luassss, dan cukup komplet. Buah/sayur seger ada juga, pecah belah, cosmetics, etc. Jelang lebaran kadang kemari belanja buat parcel. Cheaper price daripada beberapa swalayan gede lain. Advantage ofcourse!

Have no problem with the staffs. Overall selama belanja disini, santai-santai aja. Well kadang antrian rada panjang, apalagi musim parcel . Eh btw klepon gerobakan depan swalayan tuh enak! Mampir yah! 

One of supermarkets langganan Coach Ali (IG: @coachalii)",4 tahun lalu
astried aliston,5,Tempat belanja yg cukup lengkap dan harga terjangkau. Sering ada promo juga.. mantablah buat belanja bulanan,4 tahun lalu
okie maryanna,5,The best supermarket in Yogyakarta. I really lobe to spend my shopping time there.,4 tahun lalu
Chinde Bayu,5,"Lengkap murah, namun bahan segar seperti daging tidak ad",4 tahun lalu
sono harsono,4,Harga terjangkau,4 tahun lalu
Mbak Oya,5,"Perlengkapan sembako, badan, sayuran, sampai perlengkapan rumah tangga ada semua dan murah banget, harga pasar pokoknya. Tapi kalau pakaian agak mahal. Parkir murah, cuma 1k.",4 tahun lalu
hendra andriyanto,5,Mantap.. bersih murah.. antri cepat..,4 tahun lalu
Astri Indra,5,"Tempat favorit kalo belanja di jogja yg disini di cabang manapun, selalu rame. Harus sabar ngantri dikasirnya",4 tahun lalu
Meiani Ujianti,4,"Tersedia kebutuhan sehari-hari yg lengkap dan relatif lbh murah, tempat parkirnya luas dan nyaman.",4 tahun lalu
Boss Kaido,1,Pelayanan bagus kecuali satpamnya sangat tidak ramah ke konsumen,Diedit 4 tahun lalu
winaryanto andy,4,"Dit4 ini termasuk lengkap utk penuhi kebutuhan sehari hari kita.. Dan harga nya juga relatif kompetitif dibanding t4 lainya.. Saat masuk sudah terapkan prokes, jadi saat belanja dit4 ini kita merasa lebih tenang dan aman..krn smua pengunjungnya juga wajib kenakan masker saat berada di dalam swalayan tsb. Kasirnya banyak, jadi antreanya tidak begitu lama.. Jarak antara rak diaplay produk yang berdekatan, memudahkan dan kita bisa belanja lebih efisien waktu.. Dan sudah terkelompokan utk group produknya, jadi ga pusing dan berputar2 saat cari yang kita perlukan... Mantabbbb",4 tahun lalu
Ifa,3,Kurang banyak promonya sama kurang komplit gituu,4 tahun lalu
Suparno,5,"Supermarket kelas menengah ke bawah menurut saya.harga lumayan murah,tempat juga bagus & nyaman.",4 tahun lalu
siti latifah fauzi,4,"Tempat belanja paling lengkap, tempat parkirnya lumayan luas, customer service dan karyawan2nya ramah banget. ",4 tahun lalu
Hery Maryanto,5,Murah murah,4 tahun lalu
baning Sanyoto,5,Belum pernah masuk,4 tahun lalu
reren indranila,5,"Tempat belanja yang lengkap dan harga murah meriah. Ada diskon khusus tiap Jumat, Sabtu, dan Minggu.",Diedit 4 tahun lalu
Mokhamad Mahfud (SIH REKSO),5,Lengkap dan murah,4 tahun lalu
Agung Isnawan,4,"Lengkap, murah, dan terjangkau...",4 tahun lalu
Nabilla Annisa,5,"Disini lengkap, aku suka bajjuu-bajjuuu nya trendy dan ngikutin arus fashion, ada buah sayur lengkap dan fresh. Disini sudah menerapkann mennngurangiii plastik. Bisa beli buah kiloan jugaaaaaaaaaaaaaaaaaaaaaaaaaaaaaaaaa",Diedit 4 tahun lalu
Bakti .W.Astono,5,Murah dan lengkap untuk keperluan rumah tangga,4 tahun lalu
Farhan Noer,5,"Temapat belanja lengkap di jogja. Ada keburuhan harian, perlengkapa. Rumah sampai atk. Parkir luas. Masa pandemi sudah ada alat cuci tangan, cek suhu sebelum masuk",4 tahun lalu
Lesna Hetty,5,"Belanja murah , luas",4 tahun lalu
Khoirudin Nur Kholifah,4,Kemarin beli tapi kayaknya kuponnya belom jadi.. semoga tahun deoan dapat rumah,4 tahun lalu
ypith 25,5,"Kalau belanja disini lebih enak pertengahan bulan atau akhir bln.
Kalau awal bulan dijamin antriannya panjang",Diedit 4 tahun lalu
K - BORG,5,Tempat luas dan lengkap,4 tahun lalu
ika novi,5,Tempat luas belanja nyaman,4 tahun lalu
Vina Agustianingsih,5,Tempat belanjanya mahasiswa jogja,4 tahun lalu
Sultan Surya Kencana,5,Tempat belanja favorite,4 tahun lalu
Burhan A,5,"Harga bersaing, barang komplit,,, parkir luas",4 tahun lalu
