nama_penulis,rating,teks_ulasan,waktu
Mayo Sanjoto,5,Tempat belanja termurah yg menyediakan segala kebutuhan konsumen secara lengkap. Slot kasir cukup banyak sehingga dapat mengurangi antrian pembayaran yg panjang.,5 tahun lalu
KEN PRAWIRA,4,"Tempat bersih dan sesuai takaran, ada rest area dan toiletris",5 tahun lalu
Eko Sunaryo,5,Mirota Godean memang oyeeee.....,5 tahun lalu
bernadetta virnadyas,4,Lengkap dan harga terjangkau,5 tahun lalu
radikzie putri,5,Tempat belanja favorit,5 tahun lalu
dwi putri,5,"Lokasi strategis, mudah dijangkau kendaraan, harga ekonomis, tempatny nyaman",5 tahun lalu
aan genthonks,5,"Ini adalah toko kelontong yang besar , murah, parkir luas , lengkap banget (kecuali yg gak ada hehe ) langganan lama sejak dulu kala... melambai-lambai nyiur dipantai...",5 tahun lalu
Daisy Deccy,5,Murah lengkap,5 tahun lalu
Hossana Abraham Anugrah Kristi,4,Stok dapat terbilang lengkap. Fasilitas dan pelayanan memuaskan ! Saat pandemi ini sudah menerapkan protokol kesehatan dan keamanan yang dianjurkan.,5 tahun lalu
Bayuardi Bimo Bimo,5,Cukup komplit,5 tahun lalu
Novi Alisa,5,Murah,5 tahun lalu
Cahyana Purnama,4,"Lokasi toko ini memang strategis, sangat padat dengan lalu lintas, sehingga pengunjung juga banyak yang masuk ke dalamnya. Penetapan protokol kesehatan juga ada, tetapi masing-masing harus tetap bijaksana untuk menjaga diri",5 tahun lalu
nida nashuha,5,Selalu murah,5 tahun lalu
Agung Darmawan,5,Tempat belanja kebutuhan rumah tangga,5 tahun lalu
nana suryana,5,Tempat nya sangat sangat strategis harga normal,5 tahun lalu
"Adhitya ""mas_dab""",5,"tempat belanja paling murah deket rumah..saat pandemi covid belanja disini tetep aman,manajemen nya pinter handling customer",5 tahun lalu
Catur Adhi Prabowo,5,Banyak diskon wkwkwkw,5 tahun lalu
sony wrs,4,Baik dan lengkap,5 tahun lalu
Damianus Ferry,3,parkir luas,Diedit 5 tahun lalu
Kael Ar,5,Nyaman,5 tahun lalu
Yunaini,5,Supermatket di pinggiran kota Jogja. Lumayan lengkap. Dr baju sampai sayur dan buah2an tersedia. Harga berani bersaing. Di masa pandemi ini disediakan byk tempat cuci tangan.,5 tahun lalu
Faisal Bokir,5,Lengkap dan murah,5 tahun lalu
hijrah saputro,5,Banyak diskon,5 tahun lalu
anita dewi fatimah,5,Lengkap dan murmer,5 tahun lalu
mahh -,5,nyaman untuk berbelanja,5 tahun lalu
dena fei,5,Lebih tertata rapi ,5 tahun lalu
fariz,5,typical mirota,5 tahun lalu
cornelia ganes,5,MurAaaaaaaahhh,5 tahun lalu
lutfi Wibawa,4,Jalan utama ben dino,Diedit 5 tahun lalu
putri wijayanti,5,Tempat belanja bulanan ternyaman,5 tahun lalu
"hendro ""Eend"" surono",4,Good,5 tahun lalu
Mariani Sutanto,5,"Mirota Kampus salah satu swalayan yang selalu kutuju kalau belanja bulanan. Pilihannya lengkap, gradasi harganya oke banget. Jadi untuk item non makanan, ada beragam pilihan harga, tinggal pilih sesuai kebutuhan.

Untuk makanan tersedia makanan kering dan kemasan serta bahan makanan segar. Yang paling enak itu belanja ragam sayuryang sudah dipaketkan. Misalnya paket sayur pare, nah di sana sudah tersedia pare potong dan bumbu-bumbunya. Tinggal merajangnya untuk kemudian dimasak.

Mirota yang di Jl. Godean ini mempunyai dua pintu masuk. Di masing-masing pintu masuk  ada jejeran kasir sehingga pembeli bebas memilih dan tidak perlu antri lama.

Bravo Mirota, terus berinovasi dan berkembang sesuai kebutuhan pasar.",5 tahun lalu
Asseng Suroto,5,Lengkap dam murah,5 tahun lalu
Deenta Julliant,5,Very good,5 tahun lalu
Jauharotun Navisah,5,"Pusat perbelanjaan yang sangat rame.
semuanya ada.dan harganya miring.
biasanya banyak mahasiswa yg belanja disini selain ibu ibu yg sudah berkeluarga.",5 tahun lalu
rachmiasih enggarsini,5,"Tempatnya bersih, masuknya teratur, orang masuk dibatasi sehingga tidak terasa padat. Merasa lebih aman karena sebelum masuk para pengunjung disuruh cuci tangan dan rapid-test. Produknya lumayan lengkap, banyak promo. Karyawannya ramah.",5 tahun lalu
Marista Christina Shally Kabelen,5,Barang barang lengkap dan harganya lebih murah. Parkiran luas,5 tahun lalu
Dedy Simanjuntak,5,"Salah satu tempat belanja untuk keperluan bulanan dirumah yg cukup nyaman dan lengkap, dan harga yg sangat bersaing.
mulai dari sayuran, buah2an, sembako, cemilan, dll masih banyak lagi.
Pas bayar, antrian suka lumayan panjang padahal kasirnya banyak..
Tapi pelayanannya cepat..
Overall good..",5 tahun lalu
anggie,5,"Baru-baru ini kami pindah ke Sleman, Jogja untuk suatu bisnis. Otomatis musti cari-cari info mengenai banyak hal. Dan salah satu yg kami dapat adalah info tentang Mirota ini. Keren yaampun. Di Solo ngga ada yg beginian. Terharu.

Tempat (10/10) : Akses jalan sangat mudah dijangkau. Lahan parkir cukup luas untuk motor maupun mobil. Dalemnya, luaaas sekali. Sangat teramat lengkap. Inilah definisi Supermarket yg sesungguhnya  Segala kebutuhan orang normal sampai hal-hal yg tidak saya pikirkan pun ada. Hehe. Sembako, make up, sayur & buah, kue, bibit tanaman, kimchi , peralatan rumah tangga, baju, semua ada pokonya!
Pelayanan (9/10)

Harga (10/10) : Harga murah untuk kelas supermarket! Beneran. Happy kegirangan kek pengen beli semuanyaaaaaa 

Oiya, ada yg unik, ini masuk dalam protokol kesehatan, kran air dan sabun untuk cuci tangan disini keren, dimodif sedemikian rupa tanpa harus kami menyentuh kran atau sabun. Mereka mengganti putaran kran dengan pedal yg bisa kita injak untuk on off in kran dan sabun tanpa menyentuh. Besttt!!",Diedit 5 tahun lalu
Aulia Kartika Ratnaningrum,4,"Jenis kebutuhan rumah tangga lengkap tersedia.
Buah dan sayurnya fress",5 tahun lalu
02. Agatha Gwen Puspa Apsari,5,Tempat belanja keluarga lengkap dan murah tapi antrinya lumayan panjang di kala awal bulan,5 tahun lalu
Dayat,5,Bersih lengkap,5 tahun lalu
Harry Potter,4,"Mirota is a big company in jogja, cuz u can find everything about Mirota Brand.
And also Mirota is a give a lower price for everything and give u many discount.
I Love It.",5 tahun lalu
Andhita Murin,5,Nyaman buat belanja,5 tahun lalu
ambar nur hadi,5,Tenpat belanja bulanan..harga relatif lebih murah,5 tahun lalu
Vian Riandika,4,"Parkir luas, kasir banyak, sering ada promo. Semoga Sukses.",5 tahun lalu
Taufik Hidayat,3,"Tempat belanja yang ramah, harga juga terjangkau",5 tahun lalu
Winda Yunita,5,Favoritt,5 tahun lalu
Octoscorp30,5,"Lumayan lengkap buat kebutuhan sehari"" mulai dari alat"" dapur sayur buah pakaian obat""an dll.. Parkirnya juga luas, mungkin bisa sampe 10 menitan dari daerah UMY",5 tahun lalu
D. Ghozali,5,"Berbagai macam kebutuhan tersedia di tempat ini, penataan yang rapi serta terkonsep membuat para pelanggan menjadi lebih mudah untuk memilih kebutuhan yang akan dibeli ",5 tahun lalu
Erwin Setyadi,5,Siplah,5 tahun lalu
Ahok,5,Sip,5 tahun lalu
Ira Wati,5,Murah dan lengkap,5 tahun lalu
Luna House Yogyakarta,5,"One of my favourite supermarket to buy daily needs.
This is local company but the prices here inexpensive.",5 tahun lalu
Sophian Hadi Susanto,5,Lengkap bgt,5 tahun lalu
Astuti Tri Padmaningsih,5,"Langganan sejak dulu karena barang lumayan komplit, harga bersahabat, lokasi bagus. Sekarang ada gerainya Chatime pula. Setelah C-19 era pun protokol kesehatannya bagus. Disiapkan tempat cuci tangan, dicek suhu, dibatasi jumlah pengunjung, antrian kasir diberi jarak. ",5 tahun lalu
Mas kavi,5,Sip,5 tahun lalu
Reni Kusumadana,5,"Deket rumah dan emang sukanya kesini kalo belanja hhi
Harganya agak miring plus pilihannya lengkap. Dari sayur buah, toiletris, baju dsb ada semua....",5 tahun lalu
FX Suprapto,5,"Bagus, pengelolanya menerapkan protokol Covid-19 jadi jumlah pengunjung yang berbelanja selalu dibatasi dan bergantian. Hampir semua kebutuhan belanja harian tersedia, kecuali rokok.",5 tahun lalu
Raihan Rafa Wardhana,5,Tempat blanja bulanan yg nyaman & barangnya komplit,5 tahun lalu
Anita Citra,5,Lumayn,5 tahun lalu
Diego Tri Putra,4,Murah dan lengkap,5 tahun lalu
iAGITO,5,nice place to find your daily needs,5 tahun lalu
Zachariah Kirby,5,Barang lengkap dan murah.,5 tahun lalu
Zan Zan,5,barang lengkap. parkir luas,5 tahun lalu
Sjahrial Djamaludin,4,Ramai teratur,5 tahun lalu
Lanang Lucky,5,Produk komplit dan yang terpenting pelayanannya ramah serta melakukan protokol kesehatan dengan baik...mantap,5 tahun lalu
Suwarni Arni,5,"Lengkap, murah, semua ada, yang nggak ada disana ada disini..bisa beli ecer bisa beli grosir...",5 tahun lalu
Baik-baik saja,5,"Setelah diperluas jadi lebih lega dan tidak sempit seperti dulu lagi.
Dulu masih rutin 1bulan sekali inspeksi eskalator nya",5 tahun lalu
wahyuni oni,5,"Tempat a luas, nyaman.
Parkir a juga nyaman",5 tahun lalu
slamet widodo,5,"Pas pandemi covid, prosedur kesehatan diterapkan. Pengukuran suhu dan jumlah pembatasan pembeli dalam ruangan.",5 tahun lalu
Aloysia Yossy,5,Tempat belanja bulanan yg murah meriah dan lengkap..,5 tahun lalu
Risma Nur,5,Nyaman dan luas,5 tahun lalu
Halwa Santik,5,Ok,5 tahun lalu
Debora Yunita,4,"Cukup variatif, untuk supermarket termasuk lengkap. Lahan parkir lumayan luas, sekarang uda dipasang tempat cuci tangan dengan diinjak, protokol kesehatan dijalankan, belanja di siang hari lebih nyaman karena tidak terlalu padat pengunjung karena kalau lagi ramai social distancingnya suka lupa, jaraknya jadi deket banget sama pengunjung lain terutama di supermarket.",5 tahun lalu
Yuli Prihatini,3,Terkadang membingungkan dan menyasarkan,5 tahun lalu
Aulia Kartika Ratnaningrum,4,"Lengkap,bersih dan tertata rapi prodaknya sehingga mudah mencari barang yg mau dibeli",5 tahun lalu
Meirina Saras,5,jadi sering kesini gara2 ada chatime ,5 tahun lalu
Ratna Susanti,5,tempat luas utk berbelanja jd tdk perlu bertumpuk2. kasirnya banyak,5 tahun lalu
Kaswin Andrianto,5,antri,5 tahun lalu
Intan Kusuma,5,Harga murah,5 tahun lalu
Rizal Saputra,5,Tempat belanja kebutuhan rumah tangga terlengkal dan murah. Parkir juga luas.,5 tahun lalu
Dhea Nadhilah RS,5,well,5 tahun lalu
the mayeer,5,parkiran luas,5 tahun lalu
rachmat irwanto,2,Pas kemaren belanja lumayan banyak ad barang yg d kresek terpisah tertinggal msh d kasir tp knp g diingatkan sm kasirnya.. udah sampai rumah jauh..males balek lagi..y udah biar jadi hadiah buat si kasir Mirota..lain kali harus lebih teliti kasirnya,Diedit 5 tahun lalu
Pram Sasongko,5,Nyaman,5 tahun lalu
Saktiwi Bw,4,"Masih lebih lengkap yg di terban, sama-sama minim parkiran mobil",5 tahun lalu
exsan arsitek,3,Lumayan lengkap,5 tahun lalu
Virul X deadbeat,4,"Murah, lgkp, nyaman",5 tahun lalu
Ririnnadia Rahma,5,Nicee place lengkap,5 tahun lalu
ghas 01,4,Lengkap,5 tahun lalu
Kaswin Andrianto,5,ramai dan antri,5 tahun lalu
Dwi Putra,5,"Tempat belanja kebutuhan sehari hari selama bekerja d jogja.
Tempat nyaman,parkiran luas",Diedit 5 tahun lalu
Ki Bagong,4,Nice tolong pasang sopipay biar ada casback...,5 tahun lalu
Ayu,5,Ok,5 tahun lalu
Matheus Arief Yudanto,5,"Tempat belanja yang sudah legendaris. Barang nya lengkap dari peralatan rumah tangga hingga barang konsumsi. Dalam masa pandemi ini, protokol kesehatan dijalankan dengan ketat demi kenyamanan seluruh pihak.",5 tahun lalu
gxried,5,"Lengkap banget disini, wajib pakai masker dan cuci tangan. Pokoknya memenuhi protokol kesehatan deh dijamin aman. Cari apa aja lengkap.. cuma baru pertama kesana bingung kasirnya ada banyak dipintu masuk dan keluar.",5 tahun lalu
Ulfah Fauziyyah Yumna,5,Tempat belanja fav,5 tahun lalu
Yayuk Indriani,5,"Tempat belanja terfavorit sepanjang masaaaaaaaaa, luv deh",5 tahun lalu
Tya Endah,4,tempat makin luas..,5 tahun lalu
Dion Mlati,5,Mak nyus pakde bude,5 tahun lalu
Pinka pinka,5,Tempat nyaman...harga paling murah dan semoga selalu akan paling murah..tempat parkir ok...pak e parkir juga ramah semua..terimakasih,5 tahun lalu
Harry Prasetyo,1,saptam nya di tanya tentang masalah atm kurang tanggap respon nya,5 tahun lalu
Bagoest Supplier ATK,5,tempat belanja bulanan keluarga kami..,5 tahun lalu
Sgung Rintoko,5,Tempat parkirnyaman,5 tahun lalu
Dinky Anjaswari,3,"Tokonya lengkap dan murah, tapi kasirnya jutek pelayanannya!",5 tahun lalu
arfa yudha,4,"Tempatnya besar banget jadi bingung mau nyari barang, beda sama mirota simanjuntak",5 tahun lalu
Aka Al,5,"Makin luas toko dan parkirnya,,,rumah belanja terpercaya",5 tahun lalu
pempek emakqu,5,lengkap. posisi strategis,5 tahun lalu
Wahyu Wicaksono,5,Supermarket dengan semua kebutuhan rumah tangga hampir tersedia disini...,5 tahun lalu
Nina Mariani Noor,5,"Lengkap, one stop shopping",5 tahun lalu
Heri Oktagiyanto,5,Tempat belanja kebutuhan pokok tempatnya selalu ramai,5 tahun lalu
Dedy Kuncoro,5,Ok,5 tahun lalu
Agus Edi Sucipto,4,Tempstnya luas,5 tahun lalu
Zamhari Zoemarochman,5,Mirota ter da best,5 tahun lalu
Farid 21,4,"Tempatnya lumayan nyaman, lengkap juga.",5 tahun lalu
Ahmad Alfhyan,5,"Lengkap, murah tapi antrean nya kepanjangan",5 tahun lalu
Imam sulistyo,4,Swalayan yg cukup lengkap dan harga bersahabat,5 tahun lalu
anak desa cerdas,5,murah dan tempat nyaman,5 tahun lalu
Devi Agustiani,5,sering belanja disini..dlu tempatnya kecil seksrang udah besar dan banyak kebutuhan rumah tangga disediakan disini,5 tahun lalu
heni grandis,5,Lengkap,5 tahun lalu
citra manggraini,5,"Langganan beli kebutuhan sehari-hari disini. Tempatnya nyaman, luas, lengkap, parkir luas, mushola ada, toilet juga ada. Sipppp lah pokokny :)",5 tahun lalu
achmad gunadi,5,Lengkap dan murah,5 tahun lalu
Dwiyanti Kusuma,5,"Toko mirota yang mungkin paling besar. Tempat parkir luas. Barang lengkap kalo harga jangan ditanya. Lebih banyak yg lebih murah dari toko lain. Untuk sayuran dan buah2an jg tersedia, alat tulis, baju2 semua lengkap. Senang berbelanja disini. Walaupun banyak antrian tapi lumayan cepat pelayanannya. Karena kasirnya jg banyak.",5 tahun lalu
Atika P,4,"Tempatnya luas, parkir juga luas. Tapi sayangnya cuma dua lantai, jadi agak nyampur dan kadang kesulitan buat nyari produk yg mau dibeli",5 tahun lalu
Rafi Pelealu,5,Barangnya murahhh sukaa,5 tahun lalu
Black Kebab,5,Supermaketnya harganya murah,5 tahun lalu
Deni Nugroho,5,Tempat belanja sembako murah..,5 tahun lalu
Raihandi Abdillah,5,"Parkiran luas dan lega , lengkap juga pokoknya , kalau masalah macet sebenernya bukan pihak mungkin pak ogahnya cara mengatur jalannya salah",5 tahun lalu
Emirro Yahya,5,"Toko ini sangat baugb dan bisa dipercaya, banyak promo yang menarik dan pelayanan yang ramah, ini menjadi tempat langganan saya, makasih Mirota",5 tahun lalu
Franciscus Satya,5,"Barang-barang nya komplit, segala macam jenis kebutuhan sehari-hari disediakan disini.",5 tahun lalu
Resti Angel,1,Kemaren saya belanja cuma pelayananny mbak2 nmany ulfa ga sopan..saya kecewa jd males mau belanja lgi..tolong d tegur..demi kenyamanan pembeli yg lain..,5 tahun lalu
Boraa Nara,5,"Langganan belanja bulanan dong. Barangnya lumayan komplit dan tentu banyak diskon. Lahan parkirnya cukup luas. Minusnya kalo lagi rame banget (apalagi pas banyak diskon) suka desek2an sampe susah lewat, ngantri di kasirnya bikin lama juga..",5 tahun lalu
tri rini nuringtyas,1,Saya hari ini ke sini karena memang Mirota lengkap dan murah. Akan tetapi saya sedih karena hari ini saya melihat para kasir tdk diberi pembatas pelindung. Coba cek swalayan dekat anda yg di pertigaan itu mereka lebih concern dg pegawai nya. Kasir adalah org yang hrs berhadapan byk orang dan sangat rentan terkena infeksi virus. Tolong utk pihak manajemen. Saya beri kecil bintang krn anda tidak peduli pada keselamatan pekerja anda,Diedit 5 tahun lalu
Lisa A,5,"Lengkap sekali, harga sangat menjangkau seluruh kalangan. Parkir luas, nyaman, dan parkir juga murah. Sangat teramat memuaskan cari kebutuhan disini. Sukses Mirota!",5 tahun lalu
Harris Shittadevy,3,Yang dicari malah no stok :(,5 tahun lalu
anni mustarsyidah,5,Tempat yang paling lengkap buat berbelanja..dan paling murah di Yogya ya disini..semua ada..dan pelayannya ramah..rekomended deh,5 tahun lalu
Mila Mukodompit,4,Coba belanja disini gays banyak harga2 promo dan all kebutuhan RT cari di Mirota godean gays...ayooo buruan kunjugi,5 tahun lalu
Atika Yulia,5,"Ok tmpatnya enak buat berbelanja, tidak membingungkan penataannya.",5 tahun lalu
suratmi Nugroho,5,"Tempat belanja ini sudah ad sejak jaman dulu..sekarang sdh diperlebar dan ditambah dengan fasilitas yang semakin oke.tempat parkir luas.harga kompetitif...pilihan banyak dan juga disediakan undian yang hadiahnya mantap. Ada rumah, voucher belanja dan lainlain.",5 tahun lalu
Isti Kaka,5,Super ramai jalan dekat mirota ini. Overall good. Tapi tidak disarankan apabila hendak belanja dimari menggunakan mobil. Ya karena jalanan macet.,5 tahun lalu
Lydia Liem Ay Hwa,5,Murah ..komplit,5 tahun lalu
darmawan Sudrajat,5,Nice place parkir bagus. Barang lengkap. Sirkulasi di tempat belanja dalam rada pengap.,5 tahun lalu
Hafid Adikara,5,Yang jelas lebih murah belanja di sini,5 tahun lalu
Salsa Simohartono,3,Pelayanannya ramah kok..,5 tahun lalu
Ilham andi,3,Bagus,5 tahun lalu
Nandiwardhana Adhyatmika,5,"Tempat belanja yang nyaman,murah,dan cukup lengkap",Diedit 5 tahun lalu
Suparmi Parmi,5,Wah asyik belanja di sini,5 tahun lalu
Elyas Azzahra,4,Lengkap untuk belanja kebutuhan harian,5 tahun lalu
Chentia Paramita,5,Lengkap murah,5 tahun lalu
Sudaryanto PBSI FKIP UAD,5,Mirota Godean pilihan saya untuk berbelanja,5 tahun lalu
Irhamullah Yunta,5,Udah lama nggak kesini,5 tahun lalu
syaifudin wasna,5,Supermarket lokal yg cukup besar dan lengkap di sekitar Godean.. menyediakan aneka kebutuhan rumah tangga.. jam 8 pagi sudah buka.. perlu sesuatu.. monggo mampir.. ,5 tahun lalu
Rio Tri Anggara,5,"Temukan perlengkapan pribadi dan keluarga anda ,di sini...",5 tahun lalu
Vy Ws,4,Murah,5 tahun lalu
Abim Crisnawan,4,"Ramai banget..tapi barang yg sya cari ada
Tokonya komplit bgt",5 tahun lalu
Nug Sompret,5,Andalan,5 tahun lalu
Raka Putri,5,Tempat blanja terfavorit,5 tahun lalu
Mas Wawan,4,Sip,5 tahun lalu
Veni Astri,5,"Rame bangat bikin capek kaki, tapi positifnya harganya murah dan banyak diskon ya",5 tahun lalu
Arfian Irhandi,5,"Many choices of goods, cheap price and have many promos",Diedit 5 tahun lalu
Neti Sasalancana,4,Murah dan lengkap,5 tahun lalu
Fachri AR,4,"Murah, lengkap",5 tahun lalu
Rima Oktaviana,5,Dekt rumah,5 tahun lalu
Caecilia Prima Listyawati,4,"Harganya murah, pas hari Jumat lebih murah lagi banyak promo tapi sayangnya antrinya panjang dan lama banget apalagi pas awal bulan",5 tahun lalu
Perona,4,"rame banget kalo malam hari, antrian kasir pun panjang",5 tahun lalu
Adinda Dwi Puspitasari,4,Barangnya murah murah,5 tahun lalu
Anis Ria Priyanto,5,Tempat belanja kebutuhan rumah tangga paling lengkap dan setiap harinya ada barang yg diskon tapi paling banyak diskonnya setiap hari jumat..,5 tahun lalu
DevoToDios,5,"Rame terooosssss....
Tp ttp lebih asik walau rame, karena tempatnya luas",5 tahun lalu
Andi Yuwono FJS,5,Murah,5 tahun lalu
Abibaswan Hanafi,4,"Lengkap, murah, hemat di kantong mahasiswa",5 tahun lalu
Sidik Permana,5,Komplit dan ramai,5 tahun lalu
Fieta Agustina,5,Sukak belanja disini..tiap jumat banyak promo,5 tahun lalu
keseharianku aisyah,5,Tempat belanja favorit,5 tahun lalu
pia fitriani,4,"Lumayan lengkap sih barangnya, murah lagi. Tapi rame banget kalo hari jumat hehehe",5 tahun lalu
Endaruji Sedyadi,5,Lengkap banget...,5 tahun lalu
Wici Noviyani,4,"Sekarang tempatnya luas, nyaman, setiap lorong ada tulisan bagian masing2 produk jadi tidak membingungkan pembeli",5 tahun lalu
Kabamp Budiman,5,Belanja kebutuhan rumah tangga yang  lengkap dan nyaman.,5 tahun lalu
Mega vita,5,Tempat belanjanya anak kuliahan hehe,5 tahun lalu
arief budianto,5,Tempat belanja dengan harga relatif murah,5 tahun lalu
Thera Dian,4,Murah2 dan nyaman utk belanja,5 tahun lalu
Wahyu Putra,5,Mantap,5 tahun lalu
Sutopo dwi cahyono,5,Luas bangunan Nya dan murah meriah,5 tahun lalu
Kurnia Isa,5,Mantap. Mantap,5 tahun lalu
Daryono Aht,5,Asal BISA jaga harga SEMUA komoditi lebih rendah lagi insyaallah akan mendapatkan ridho dari Allah swt.,5 tahun lalu
Rima Oktaviana,5,Tempat belanja lengkap,5 tahun lalu
Retnaningdyah W,5,"Komplet, murah, nyaman ",5 tahun lalu
Arief Ns,5,Barang barang relatif lebih murah di banding supermarket lain,5 tahun lalu
Mu' addin,5,"Harga mirota beberapa ada yg lebih murah dibanding swalayan lain,cukup lengkap. Setiap kesini pasti ketagihan. Parkiran jg cukuplah.",5 tahun lalu
Agnes Ardiana,4,"Recomended untuk belanja bulanan, murah, lengkap, dan yang di Godean parkir luas. Space antar rak belanja kurang luas, sehingga sulit papasan 2 troli. Saran kalau mau belanja banyak mending siang hari atau sebelum magrib, karena kalau malam ramai sekali. Antrian bayar panjang banget. Saran juga untuk pengunjung jangan malu untuk bawa kantong belanja sendiri, dan saling membantu kasir memasukkan belanjaan. Supaya lebih cepat, dan tidak membuat antrian berikutnya menunggu lebih lama. Semoga bermanfaat",5 tahun lalu
kiswanta nhl,5,"lengkap, harga mahasiswa, kwalitas numero uno, pokoknya makin berkembang deh",Diedit 5 tahun lalu
Siwi Kholifa,5,"Barang nya lengkap bangettt, harga juga lebih miring",5 tahun lalu
Joko Dwi Prasetyo,5,"Belanja puas banyak promo, diskon, harga terjangkau, tempat nyaman, ya disini.",5 tahun lalu
Laily Diastiardi C A,1,Tulisannya diskon tapi waktu di bayar dinota nya ga diskon gimana si. Penipuan namanya,5 tahun lalu
Eril Obeit Choiri,5,Murah dan lengkap,5 tahun lalu
chia rizki,5,"mirota yg paling lebar dari yg lain, jadinya nyaman",5 tahun lalu
Sang Surya,5,Murah dan komplit tapi harus sabar menunggu antri di kasir,5 tahun lalu
Kasiyadiyadi,3,Mantap,5 tahun lalu
#RAHADIAN#,4,"Products almost complete and the price is fair and cheaper than other shops. But a little bit disappointing is the service of employee.. They are almost aren't responsive, familiar and expensive with their smile.. However, we all are costumer and we need a good service.. Not just good products..",5 tahun lalu
nur edi psy,5,"Murah.
Akeh promo.",5 tahun lalu
Sapta Pratama,5,Murah,5 tahun lalu
Biji Kuda,5,Murraaah pelayanan maantuuulll,5 tahun lalu
Seneng Dolan,4,"Seperti mirota pada umumnya, tempat belanja mulai dari daleman, baju, celana, dan aneka kebutuhan rumah tangga lainnya",5 tahun lalu
Imam Syahroni,3,Murah..komolit..deket..inilah tempatnya,5 tahun lalu
Putricaa,4,"Tempatnya semakin luas, dan lengkap .",5 tahun lalu
Dheni Ferstiono,4,Handuk murah,5 tahun lalu
Ferika Chandrarini,5,"Jalan di dalam swalayan ini terlalu sempit,  apalagi saat sedang ramai bingung lewat nya",Diedit 5 tahun lalu
Achmad Maulana,5,very cheap price and good quality product,Diedit 5 tahun lalu
Indah,5,T4 kerja ku yg nyaman,5 tahun lalu
hesti susanti,5,"1. Salah satu supermarket di jogja yg harus dikunjungi
2. Tempat parkir luas,  motor dan mobil bisa parkir.  Harga tiket parkirnya juga wajar
3. Banyak promo,  hampir setiap hari ada promo
4. Lengkap,  segala macam kebutuhan alat rumahtangga ada.  Dari sayur mayur,  fashion,  elektronik dll
5. Walaupun kasirnya banyak,  tapi kalau pas tgl gajian rame banget",5 tahun lalu
nurul anisak,5,"My favourite supermarket to do a monthly grocery shopping: it's cheaper than other supermarket, parking lot is spacious, chill inside, very comfortable, cashier service is fast and the most important is ""Loooots of discounts"" ",5 tahun lalu
Noto Sumarto,5,Makim rame swalayan ini,5 tahun lalu
soni joe,5,"Lengkap ,parkir sekarang lebih nyaman lebih luas....",5 tahun lalu
Bonny Prasetya,5,Langganan tiap isi kulkas dan perlengkapan bulanan.,5 tahun lalu
Shabrina Qurrota A'yun,5,"Harga terjangkau, kualitas oke",5 tahun lalu
Dimas Rayyans,4,Mantaph  kasir banyak parkir nyaman,5 tahun lalu
AWDENIX,5,Langganan kalo belanja di Mirota. Hemat dan lengkap,5 tahun lalu
June Watson,5,"Love it, many things are available here",5 tahun lalu
Wahyu,5,tersediaa berbagai macam kebutuhan keluargaaa. lengkap pokoknya,6 tahun lalu
Indah Mayasari,5,"Supermarket murah, dekat",6 tahun lalu
Abdul Alief,4,"In the back is the new area, making this place a lot bigger, complete goods selection, especially everyday stuff you need. some layout display need to be re arrange, because at some alley, the space is tight for 2 trolley to cross. And at the beginning of the month, the queue at cashier could take a lot of time.. So, many people shop here..",Diedit 6 tahun lalu
Dwi Hutami A,4,Good place for grocery shopping. Friday is always crowded because they have discount items.,6 tahun lalu
sapphire sapphire,5,"Sewaktu singgah di Yogyakarta, saya suka mampir ke sini untuk belanja kebutuhan pribadi. Produk-produknya lengkap dan sering menawarkan diskon atau promo terutama di hari Jumat.",6 tahun lalu
Alfina Eryani,5,"Mirota Godean merupakan tempat belanja yang lengkap dan murah,
Saat ini gedung lebih luas dari yang dulu, lantai 2 maaih dalam tahap renovasi,
Parkir motor dan mobil di sebelah pintu Utara dan beberapa mobil masih parkir di muka mirota pas samping perempatan, untuk barang pecah belah ada di bagian barat pintu masuk utara, penataan produk dan harga cukup rapi dan detail, namun ruang jalan di etalase produk agak sempit, tidak bisa menggunakan troli hanya keranjang plastik dorong, bila suka kenyamanan datang lah selain hari jumat,sabtu,minggu ,karena penuh sesak... Dan kalau mau jumat,sabtu,minggu datang pagi2 awal2 toko buka saja bagi pecinta promo dan diskon pasti tak melewatkan hari jumat-minggu...",6 tahun lalu
amal akbar yasser arafat,5,"harga murah, tapi suka penuh kalau weekend sore susah dapat parkir mobil",6 tahun lalu
Henry Zheng,4,"Mirota Godean salah satu toko swalayan yang cukup lengkap, cukup luas dan produknya bervariasi.
Berbagai jenis produk tersedia disini, mulai dari pakaian, kebutuhan sehari2, stationary, listrik, kecantikan, dll.
Parkiran cukup luas
Toilet ada di luar
Pelayanan juga cukup cepat dan ramah.",6 tahun lalu
Wahyudi 98,5,"Bersih,nyaman,terjangkau,",6 tahun lalu
